# hmmsearch :: search profile(s) against a sequence database
# HMMER 3.4 (Aug 2023); http://hmmer.org/
# Copyright (C) 2023 Howard Hughes Medical Institute.
# Freely distributed under the BSD open source license.
# - - - - - - - - - - - - - - - - - - - - - - - - - - - - - - - - - - - -
# query HMM file:                  ../HMMs/combined_nif_04012025.hmm
# target sequence database:        ../all_rep_proteins_aa/bacteria/GB_GCA_017983955.1_protein.faa
# - - - - - - - - - - - - - - - - - - - - - - - - - - - - - - - - - - - -

Query:       nifH-03292025  [M=327]
Scores for complete sequences (score includes all domains):
   --- full sequence ---   --- best 1 domain ---    -#dom-
    E-value  score  bias    E-value  score  bias    exp  N  Sequence             Description
    ------- ------ -----    ------- ------ -----   ---- --  --------             -----------
    5.6e-09   33.1   0.0    2.9e-06   24.2   0.0    2.1  2  JAGOAJ010000032.1_23  # 29350 # 30174 # 1 # ID=47_23;partial=
    2.2e-05   21.3   0.0    0.00013   18.7   0.1    2.0  2  JAGOAJ010000017.1_20  # 17077 # 18162 # 1 # ID=2_20;partial=0
    3.2e-05   20.8   0.1    0.00026   17.8   0.1    2.1  2  JAGOAJ010000013.1_59  # 65611 # 66426 # -1 # ID=49_59;partial


Domain annotation for each sequence (and alignments):
>> JAGOAJ010000032.1_23  # 29350 # 30174 # 1 # ID=47_23;partial=00;start_type=ATG;rbs_motif=AGGA;rbs_spacer=5-10bp;gc_co
   #    score  bias  c-Evalue  i-Evalue hmmfrom  hmm to    alifrom  ali to    envfrom  env to     acc
 ---   ------ ----- --------- --------- ------- -------    ------- -------    ------- -------    ----
   1 !   24.2   0.0   2.8e-09   2.9e-06      17      52 ..      19      54 ..      11      87 .. 0.91
   2 !    6.9   0.0   0.00048      0.51     149     256 ..     149     261 ..     146     270 .. 0.81

  Alignments for each domain:
  == domain 1  score: 24.2 bits;  conditional E-value: 2.8e-09
         nifH-03292025 17 KGGiGKSttasnlsaalaeegkkvlivGCdPKaDst 52
                          KGG+GK tta nl+aala   k+vl +  dP   +t
  JAGOAJ010000032.1_23 19 KGGVGKTTTAINLAAALAMLRKRVLLIDLDPQGNAT 54
                          9******************************98887 PP

  == domain 2  score: 6.9 bits;  conditional E-value: 0.00048
         nifH-03292025 149 adevyivtsgemmalYaanniakgikkyaee..ggvrlgGl..icNsrkvdkeeelveefaeklgtqiiaf.vprsnevqkaelekktv 232
                           a+ v++ + +e+ al    +++++ik+++++   + +l Gl  ++   +v+ ++++  ++ +++g ++ ++ vpr+  + +a  ++   
  JAGOAJ010000032.1_23 149 AHGVIVPMQCEYFALEGLSDLVNTIKRVHHNinPQLQLIGLlrVMFDTRVTLQQQVSAQIENHFGDKVYKTiVPRNVRLAEAPSHGLPG 237
                           6778888999******************9994456677888333445566778888888999999999875379999999999999999 PP

         nifH-03292025 233 ieaapdseqakeyreLakkilenk 256
                           + ++++s+ ak+y e+ ++++++ 
  JAGOAJ010000032.1_23 238 VIYDKNSRGAKAYVEFGNELMKQV 261
                           99*************999998765 PP

>> JAGOAJ010000017.1_20  # 17077 # 18162 # 1 # ID=2_20;partial=00;start_type=ATG;rbs_motif=GGA/GAG/AGG;rbs_spacer=5-10bp
   #    score  bias  c-Evalue  i-Evalue hmmfrom  hmm to    alifrom  ali to    envfrom  env to     acc
 ---   ------ ----- --------- --------- ------- -------    ------- -------    ------- -------    ----
   1 !   18.7   0.1   1.3e-07   0.00013      15      40 ..     104     129 ..      91     147 .. 0.88
   2 ?    0.0   0.0      0.06        64     153     193 ..     233     269 ..     188     352 .. 0.63

  Alignments for each domain:
  == domain 1  score: 18.7 bits;  conditional E-value: 1.3e-07
         nifH-03292025  15 YGKGGiGKSttasnlsaalaeegkkv 40 
                            GKGG+GKStt+ nl+ al   g +v
  JAGOAJ010000017.1_20 104 SGKGGVGKSTTSVNLALALHGLGARV 129
                           4******************9999887 PP

  == domain 2  score: 0.0 bits;  conditional E-value: 0.06
         nifH-03292025 153 yivtsgemmalYaanniakgikkyaeeggvrlgGlicNsrk 193
                           +ivt+ + mal  a    +g++ ++ + +v + G+i N+  
  JAGOAJ010000017.1_20 233 VIVTTPQDMALADA---RRGLRMFQ-KVDVPVLGIIENMSM 269
                           57777777777544...56777766.456777888888654 PP

>> JAGOAJ010000013.1_59  # 65611 # 66426 # -1 # ID=49_59;partial=00;start_type=ATG;rbs_motif=AGGA/GGAG/GAGG;rbs_spacer=1
   #    score  bias  c-Evalue  i-Evalue hmmfrom  hmm to    alifrom  ali to    envfrom  env to     acc
 ---   ------ ----- --------- --------- ------- -------    ------- -------    ------- -------    ----
   1 !   17.8   0.1   2.4e-07   0.00026      15      43 ..       9      37 ..       1      71 [. 0.90
   2 ?    1.0   0.0      0.03        32     191     248 ..     186     242 ..     130     257 .. 0.78

  Alignments for each domain:
  == domain 1  score: 17.8 bits;  conditional E-value: 2.4e-07
         nifH-03292025 15 YGKGGiGKSttasnlsaalaeegkkvliv 43
                           GKGG+GK tt++  s  la +g+k +++
  JAGOAJ010000013.1_59  9 SGKGGVGKTTTSASFSSGLAMRGHKTVVI 37
                          5***********************99887 PP

  == domain 2  score: 1.0 bits;  conditional E-value: 0.03
         nifH-03292025 191 srkvdkeeelveefaeklgtqiiafvprsnevqkaelekktvieaapdseqakeyreL 248
                           +r  + e   ++++ + l++++i   p+s++v +a  ++   i++ + ++  ++y+++
  JAGOAJ010000013.1_59 186 KRVAEGEMLSLKDIEDILRIKLIGVTPESETVLQASNQGIAAIHMRE-TDVSQAYQDV 242
                           55666666777788888899999999999999999999988887765.4555666654 PP



Internal pipeline statistics summary:
-------------------------------------
Query model(s):                            1  (327 nodes)
Target sequences:                       3172  (1028376 residues searched)
Passed MSV filter:                       161  (0.0507566); expected 63.4 (0.02)
Passed bias filter:                      137  (0.0431904); expected 63.4 (0.02)
Passed Vit filter:                        23  (0.00725095); expected 3.2 (0.001)
Passed Fwd filter:                         3  (0.000945776); expected 0.0 (1e-05)
Initial search space (Z):               3172  [actual number of targets]
Domain search space  (domZ):               3  [number of targets reported over threshold]
# CPU time: 0.03u 0.00s 00:00:00.03 Elapsed: 00:00:00.02
# Mc/sec: 13791.59
//
Query:       nifD-03292025  [M=482]
Scores for complete sequences (score includes all domains):
   --- full sequence ---   --- best 1 domain ---    -#dom-
    E-value  score  bias    E-value  score  bias    exp  N  Sequence Description
    ------- ------ -----    ------- ------ -----   ---- --  -------- -----------

   [No hits detected that satisfy reporting thresholds]


Domain annotation for each sequence (and alignments):

   [No targets detected that satisfy reporting thresholds]


Internal pipeline statistics summary:
-------------------------------------
Query model(s):                            1  (482 nodes)
Target sequences:                       3172  (1028376 residues searched)
Passed MSV filter:                        89  (0.028058); expected 63.4 (0.02)
Passed bias filter:                       82  (0.0258512); expected 63.4 (0.02)
Passed Vit filter:                         6  (0.00189155); expected 3.2 (0.001)
Passed Fwd filter:                         0  (0); expected 0.0 (1e-05)
Initial search space (Z):               3172  [actual number of targets]
Domain search space  (domZ):               0  [number of targets reported over threshold]
# CPU time: 0.03u 0.00s 00:00:00.03 Elapsed: 00:00:00.02
# Mc/sec: 24345.11
//
Query:       nifK-03292025  [M=490]
Scores for complete sequences (score includes all domains):
   --- full sequence ---   --- best 1 domain ---    -#dom-
    E-value  score  bias    E-value  score  bias    exp  N  Sequence Description
    ------- ------ -----    ------- ------ -----   ---- --  -------- -----------

   [No hits detected that satisfy reporting thresholds]


Domain annotation for each sequence (and alignments):

   [No targets detected that satisfy reporting thresholds]


Internal pipeline statistics summary:
-------------------------------------
Query model(s):                            1  (490 nodes)
Target sequences:                       3172  (1028376 residues searched)
Passed MSV filter:                        70  (0.0220681); expected 63.4 (0.02)
Passed bias filter:                       64  (0.0201765); expected 63.4 (0.02)
Passed Vit filter:                         4  (0.00126103); expected 3.2 (0.001)
Passed Fwd filter:                         0  (0); expected 0.0 (1e-05)
Initial search space (Z):               3172  [actual number of targets]
Domain search space  (domZ):               0  [number of targets reported over threshold]
# CPU time: 0.02u 0.01s 00:00:00.03 Elapsed: 00:00:00.02
# Mc/sec: 23087.02
//
Query:       nifB-03292025  [M=505]
Scores for complete sequences (score includes all domains):
   --- full sequence ---   --- best 1 domain ---    -#dom-
    E-value  score  bias    E-value  score  bias    exp  N  Sequence             Description
    ------- ------ -----    ------- ------ -----   ---- --  --------             -----------
    3.1e-08   30.0   1.1    6.3e-06   22.4   0.2    2.5  2  JAGOAJ010000004.1_14  # 12244 # 13326 # -1 # ID=22_14;partial


Domain annotation for each sequence (and alignments):
>> JAGOAJ010000004.1_14  # 12244 # 13326 # -1 # ID=22_14;partial=00;start_type=ATG;rbs_motif=None;rbs_spacer=None;gc_con
   #    score  bias  c-Evalue  i-Evalue hmmfrom  hmm to    alifrom  ali to    envfrom  env to     acc
 ---   ------ ----- --------- --------- ------- -------    ------- -------    ------- -------    ----
   1 !    5.4   0.0   0.00028      0.89      79      95 ..      35      51 ..      29      58 .. 0.90
   2 !   22.4   0.2     2e-09   6.3e-06     164     273 ..     120     216 ..      94     224 .. 0.88

  Alignments for each domain:
  == domain 1  score: 5.4 bits;  conditional E-value: 0.00028
         nifB-03292025 79 mHvavApaCNiqCnyCn 95
                          m ++v   CN  C yC 
  JAGOAJ010000004.1_14 35 MRISVTDRCNFRCTYCM 51
                          889*************6 PP

  == domain 2  score: 22.4 bits;  conditional E-value: 2e-09
         nifB-03292025 164 lklClstNGLaLpeyvdelaelnvdhvtvTiNavdpeigakiypwvlyekkrytgeeaaeiLlerQlegleklaergvl.vKvNsvlip 251
                           + l l+tN   L++ ++ l++ +++ vtv + a+d  +              ++    +++ ++  l g+e+ a+ g++ vKvN v+ +
  JAGOAJ010000004.1_14 120 VDLTLTTNATLLAKRAQALKDAGLHRVTVSLDALDETV--------------FQSMSDSKVTVRTVLDGIEEAARVGLTpVKVNMVVRK 194
                           67889******************************954..............344556778888999**********9779******** PP

         nifB-03292025 252 gvNdehlvevakkvkekgaflh 273
                           g+Nd+++  + ++ + +g +l 
  JAGOAJ010000004.1_14 195 GINDDQILPMVRHFRGSGHVLR 216
                           ************9999998775 PP



Internal pipeline statistics summary:
-------------------------------------
Query model(s):                            1  (505 nodes)
Target sequences:                       3172  (1028376 residues searched)
Passed MSV filter:                        68  (0.0214376); expected 63.4 (0.02)
Passed bias filter:                       55  (0.0173392); expected 63.4 (0.02)
Passed Vit filter:                         5  (0.00157629); expected 3.2 (0.001)
Passed Fwd filter:                         1  (0.000315259); expected 0.0 (1e-05)
Initial search space (Z):               3172  [actual number of targets]
Domain search space  (domZ):               1  [number of targets reported over threshold]
# CPU time: 0.02u 0.00s 00:00:00.02 Elapsed: 00:00:00.01
# Mc/sec: 29203.71
//
Query:       nifE-03292025  [M=556]
Scores for complete sequences (score includes all domains):
   --- full sequence ---   --- best 1 domain ---    -#dom-
    E-value  score  bias    E-value  score  bias    exp  N  Sequence Description
    ------- ------ -----    ------- ------ -----   ---- --  -------- -----------

   [No hits detected that satisfy reporting thresholds]


Domain annotation for each sequence (and alignments):

   [No targets detected that satisfy reporting thresholds]


Internal pipeline statistics summary:
-------------------------------------
Query model(s):                            1  (556 nodes)
Target sequences:                       3172  (1028376 residues searched)
Passed MSV filter:                       120  (0.037831); expected 63.4 (0.02)
Passed bias filter:                      105  (0.0331021); expected 63.4 (0.02)
Passed Vit filter:                        13  (0.00409836); expected 3.2 (0.001)
Passed Fwd filter:                         0  (0); expected 0.0 (1e-05)
Initial search space (Z):               3172  [actual number of targets]
Domain search space  (domZ):               0  [number of targets reported over threshold]
# CPU time: 0.03u 0.00s 00:00:00.03 Elapsed: 00:00:00.03
# Mc/sec: 18286.31
//
Query:       nifN-03292025  [M=700]
Scores for complete sequences (score includes all domains):
   --- full sequence ---   --- best 1 domain ---    -#dom-
    E-value  score  bias    E-value  score  bias    exp  N  Sequence Description
    ------- ------ -----    ------- ------ -----   ---- --  -------- -----------

   [No hits detected that satisfy reporting thresholds]


Domain annotation for each sequence (and alignments):

   [No targets detected that satisfy reporting thresholds]


Internal pipeline statistics summary:
-------------------------------------
Query model(s):                            1  (700 nodes)
Target sequences:                       3172  (1028376 residues searched)
Passed MSV filter:                       134  (0.0422446); expected 63.4 (0.02)
Passed bias filter:                      100  (0.0315259); expected 63.4 (0.02)
Passed Vit filter:                         9  (0.00283733); expected 3.2 (0.001)
Passed Fwd filter:                         0  (0); expected 0.0 (1e-05)
Initial search space (Z):               3172  [actual number of targets]
Domain search space  (domZ):               0  [number of targets reported over threshold]
# CPU time: 0.04u 0.00s 00:00:00.04 Elapsed: 00:00:00.02
# Mc/sec: 30285.55
//
Query:       pchlide-04012025  [M=508]
Scores for complete sequences (score includes all domains):
   --- full sequence ---   --- best 1 domain ---    -#dom-
    E-value  score  bias    E-value  score  bias    exp  N  Sequence Description
    ------- ------ -----    ------- ------ -----   ---- --  -------- -----------

   [No hits detected that satisfy reporting thresholds]


Domain annotation for each sequence (and alignments):

   [No targets detected that satisfy reporting thresholds]


Internal pipeline statistics summary:
-------------------------------------
Query model(s):                            1  (508 nodes)
Target sequences:                       3172  (1028376 residues searched)
Passed MSV filter:                        83  (0.0261665); expected 63.4 (0.02)
Passed bias filter:                       71  (0.0223834); expected 63.4 (0.02)
Passed Vit filter:                         4  (0.00126103); expected 3.2 (0.001)
Passed Fwd filter:                         0  (0); expected 0.0 (1e-05)
Initial search space (Z):               3172  [actual number of targets]
Domain search space  (domZ):               0  [number of targets reported over threshold]
# CPU time: 0.02u 0.00s 00:00:00.02 Elapsed: 00:00:00.01
# Mc/sec: 34305.53
//
[ok]
# hmmsearch :: search profile(s) against a sequence database
# HMMER 3.4 (Aug 2023); http://hmmer.org/
# Copyright (C) 2023 Howard Hughes Medical Institute.
# Freely distributed under the BSD open source license.
# - - - - - - - - - - - - - - - - - - - - - - - - - - - - - - - - - - - -
# query HMM file:                  ../HMMs/nifV_07242025.hmm
# target sequence database:        ../all_rep_proteins_aa/bacteria/GB_GCA_017983955.1_protein.faa
# - - - - - - - - - - - - - - - - - - - - - - - - - - - - - - - - - - - -

Query:       nifV-07242025  [M=437]
Scores for complete sequences (score includes all domains):
   --- full sequence ---   --- best 1 domain ---    -#dom-
    E-value  score  bias    E-value  score  bias    exp  N  Sequence              Description
    ------- ------ -----    ------- ------ -----   ---- --  --------              -----------
    7.5e-28   95.2   0.0    8.7e-27   91.7   0.0    2.0  1  JAGOAJ010000014.1_1    # 209 # 1900 # 1 # ID=50_1;partial=00;
    1.2e-27   94.5   4.9    9.1e-27   91.6   4.9    2.0  1  JAGOAJ010000014.1_28   # 35697 # 36725 # -1 # ID=50_28;partia
    2.7e-26   90.1   0.0    3.3e-26   89.8   0.0    1.0  1  JAGOAJ010000001.1_236  # 245620 # 246534 # -1 # ID=6_236;part
    2.1e-23   80.6   5.9      2e-21   74.0   5.9    2.3  1  JAGOAJ010000016.1_30   # 29241 # 30269 # -1 # ID=1_30;partial
      1e-19   68.4   0.9    1.2e-19   68.2   0.9    1.0  1  JAGOAJ010000006.1_143  # 132775 # 133728 # -1 # ID=27_143;par
    5.3e-18   62.7   1.4    6.8e-18   62.4   1.4    1.2  1  JAGOAJ010000012.1_57   # 52675 # 53583 # 1 # ID=44_57;partial
    4.2e-16   56.5   1.9    5.4e-16   56.1   1.9    1.1  1  JAGOAJ010000015.1_7    # 5731 # 6636 # -1 # ID=56_7;partial=0


Domain annotation for each sequence (and alignments):
>> JAGOAJ010000014.1_1  # 209 # 1900 # 1 # ID=50_1;partial=00;start_type=ATG;rbs_motif=GGA/GAG/AGG;rbs_spacer=5-10bp;gc_
   #    score  bias  c-Evalue  i-Evalue hmmfrom  hmm to    alifrom  ali to    envfrom  env to     acc
 ---   ------ ----- --------- --------- ------- -------    ------- -------    ------- -------    ----
   1 !   91.7   0.0   1.9e-29   8.7e-27      20     387 ..      37     440 ..      23     490 .. 0.78

  Alignments for each domain:
  == domain 1  score: 91.7 bits;  conditional E-value: 1.9e-29
        nifV-07242025  20 DtTLRDGeQaaGvaFsleeklaiAkaLdaaGveelEvGipamGeeereairaiaa.lglk..akllaW..cR..lresdieaaaalgvkr 102
                           t LRDG+Q+    +s+e k++  ++L ++G +e+EvG p+ ++++ + +r++ + ++++   ++++   +R  l ++ +eaaa  +  +
  JAGOAJ010000014.1_1  37 STDLRDGNQSLIEPMSVERKMRFFQQLLKIGFKEIEVGFPSASQTDFDFVRTLIDgKHIPddVTIIVLtqSRedLIKRTVEAAAGAKQAI 126
                          589************************************************987613344334555540144334567789999999999 PP

        nifV-07242025 103 vdlsipvSdiqiaaklk....rdrawvl...eeleelvklAldaglevsvGaEDaSRadeefllevaevaqea......GasrlRfaDTl 179
                          v+l  + + +  +  ++    + ++++l   + +++++++  ++  +     E  S +++ef l+v ++++++          + +  T+
  JAGOAJ010000014.1_1 127 VHLYNACAPVFRKIVFNmdkdQIKQIALdgtRLVKQYISQHPETTWRYQYSPEVFSTTEPEFALDVCNAVTAVwqptpeSKIIFNLPATV 216
                          999776666666555552222223334311145688899999999999****************998876554222222344577789** PP

        nifV-07242025 180 GildPfttlekvkkLraald....lelEmHaHnDlGlAtANtlaavkaGathvnttvnGLGERAGnAaLeevvlalkrlygidtgidlkr 265
                              P   +++++ ++++l+    + l +H HnD G A A +  av aGa  ++  + G GER Gn  L  ++l l + +gi+ g+d+++
  JAGOAJ010000014.1_1 217 EATTPNMYADQIEWMHNSLNqrdcIILSVHPHNDRGTAVAAAELAVMAGADRIEGCLFGNGERTGNVDLVTLALNLYT-QGIHPGLDFSD 305
                          ************876665542222789******************************************999999988.9********** PP

        nifV-07242025 266 lpelselvakasgrpvpaqkaivGeavFtHEsGiHvdgllk.....dpet.....YegldPeevGrerrlvl..GkhsGraavkaala.e 342
                          + e+ ++v+   + pv+++++  G+ vFt  sG H d++ k     +p+t     Y ++dP+++Gr++  v+     sG+ +v+ +l+ e
  JAGOAJ010000014.1_1 306 IDEVRRCVEYCNQLPVHPRHPYAGDLVFTAFSGSHQDAIKKgfarqQPNTlwevpYLPIDPADLGRSYDAVIrvNSQSGKGGVSYLLEqE 395
                          **************************************98722222333344444777**********9996226889******999626 PP

        nifV-07242025 343 lgieldeeeaealleavrelaeetkrslteeeLlelveellaaee 387
                          +g+ l ++   +  +a+++++ et  +++++++ +++++   +++
  JAGOAJ010000014.1_1 396 HGLVLPRRLQIEFSRAIQRVTDETGAEVDAAKVYDIFNTEYLQQT 440
                          8999999999999******************99999988553222 PP

>> JAGOAJ010000014.1_28  # 35697 # 36725 # -1 # ID=50_28;partial=00;start_type=ATG;rbs_motif=GGA/GAG/AGG;rbs_spacer=5-10
   #    score  bias  c-Evalue  i-Evalue hmmfrom  hmm to    alifrom  ali to    envfrom  env to     acc
 ---   ------ ----- --------- --------- ------- -------    ------- -------    ------- -------    ----
   1 !   91.6   4.9     2e-29   9.1e-27      15     254 ..       3     242 ..       1     257 [. 0.72

  Alignments for each domain:
  == domain 1  score: 91.6 bits;  conditional E-value: 2e-29
         nifV-07242025  15 avvinDtTLRDGeQaaGvaFsleeklaiAkaLdaaGveelEvGip........amGeeereairaiaal...glkak...llaWcRlre 89 
                           +v+i D TLRDG+ + G  F+ e   + A aLd+aGv+ +EvG           +G++ +++++ i+a+     +ak   +l     + 
  JAGOAJ010000014.1_28   3 KVTIVDVTLRDGNHTYGHQFTPEIVAKTAAALDRAGVDYIEVGHGdglggsciHVGRSATSDMELIKAAvgaVKNAKisiILIPGMGSF 91 
                           69****************************************97521111111233333333333322100011111000122222233 PP

         nifV-07242025  90 sdieaaaalgvkrvdlsipvSdiqiaaklkrdrawvleeleelvklA.ldaglevsvGaEDaSRadeefllevaevaqeaGasrlRfaD 177
                           +d+e++a+lgv++  +     +            ++ ++l+++ +l  l  g+ vsvG+        e l++ a+  ++ Ga+ + +a+
  JAGOAJ010000014.1_28  92 QDLEMSAELGVSMARIGTHCTEAD----------ITEQHLQRAADLGlLPVGYLVSVGMAS-----AERLASEAAKMESYGAQYINLAE 165
                           444444444444444444444443..........44444555555441467999****955.....56688889999************ PP

         nifV-07242025 178 TlGildPfttlekvkkLraaldlelEmHaHnDlGlAtANtlaavkaGathvnttvnGLGERAGnAaLeevvlalkrl 254
                             G l P +++e+++++r+a+++++ +H Hn lGlA  N laa+  Gat+++  ++G G  AGnA  e  v+alk+ 
  JAGOAJ010000014.1_28 166 SQGHLVPSEVAERIRAVRKAVKIPIGFHPHNNLGLAIGNILAALGEGATFIDGSLKGFGGGAGNAQTEVAVAALKKA 242
                           **************************************************************************983 PP

>> JAGOAJ010000001.1_236  # 245620 # 246534 # -1 # ID=6_236;partial=00;start_type=ATG;rbs_motif=GGxGG;rbs_spacer=5-10bp;
   #    score  bias  c-Evalue  i-Evalue hmmfrom  hmm to    alifrom  ali to    envfrom  env to     acc
 ---   ------ ----- --------- --------- ------- -------    ------- -------    ------- -------    ----
   1 !   89.8   0.0   7.3e-29   3.3e-26      14     281 ..       3     286 ..       1     293 [. 0.83

  Alignments for each domain:
  == domain 1  score: 89.8 bits;  conditional E-value: 7.3e-29
          nifV-07242025  14 kavvinDtTLRDGeQaaGvaFsleeklaiAkaLdaaGveelEv.......GipamGeeereairaiaalglkakllaWcRl..resdi 92 
                            ++v i+    RDG Q       +++k++  ++L+++G +++Ev        ipa++++e+  ++ i++     + ++++ l  + +  
  JAGOAJ010000001.1_236   3 SKVYIQEVAPRDGFQGESRFIDTADKISFINHLSNCGFAKIEVtsftspkAIPALSDAETV-MKGIVR----NSSVVYSSLvpNVRGA 85 
                            4699999999*********************************555544459999999875.555554....3333444331145677 PP

          nifV-07242025  93 eaaaalgvkrvdlsipvSdiqiaaklkrdrawvleeleelvklAldaglevsv......GaEDaSRadeefllevaevaqeaGasrlR 174
                            + a + gv+ ++l ++vS+ + ++ l+ +r+  ++ l +++++  +a +++ v      G+      d + +l++++  +e+G+  + 
  JAGOAJ010000001.1_236  86 QRALESGVDELNLVMSVSESHNRSNLRMSREASFSALVDVINYVGNATVSINVslstvfGCPFDGNVDFASVLQLVDRFAELGVDGIT 173
                            89999*************************9999999999998766655444322333388888999********************* PP

          nifV-07242025 175 faDTlGildPfttlekvkkLraa.ldlelEmHaHnDlGlAtANtlaavkaGathvnttvnGLGE......RAGnAaLeevvlalkrly 255
                            f+DT G+  P ++++  ++L+++  +l+l mH Hn  G+A ANtlaav aG    +  v G+G        +Gn   e++v  l+ l+
  JAGOAJ010000001.1_236 174 FCDTTGMAYPTQVQKISSTLVEHyAPLDLTMHFHNTRGMALANTLAAVDAGIYRFDSSVGGIGGcpfapgASGNTCTEDLVHMLH-LM 260
                            ********************987258*************************************733333368*******999886.59 PP

          nifV-07242025 256 gidtgidlkrlpelselvakasgrpv 281
                            g+dtg+dl  l + +++  +  g+++
  JAGOAJ010000001.1_236 261 GYDTGVDLGMLVATAAQLPDMVGHEI 286
                            ********999998887777666665 PP

>> JAGOAJ010000016.1_30  # 29241 # 30269 # -1 # ID=1_30;partial=00;start_type=ATG;rbs_motif=AGGA;rbs_spacer=5-10bp;gc_co
   #    score  bias  c-Evalue  i-Evalue hmmfrom  hmm to    alifrom  ali to    envfrom  env to     acc
 ---   ------ ----- --------- --------- ------- -------    ------- -------    ------- -------    ----
   1 !   74.0   5.9   4.5e-24     2e-21      14     271 ..       6     264 ..       1     277 [. 0.76

  Alignments for each domain:
  == domain 1  score: 74.0 bits;  conditional E-value: 4.5e-24
         nifV-07242025  14 kavvinDtTLRDGeQaaGvaFsleeklaiAkaLdaaGveelEv.............GipamGeeer..eairaiaalglkakllaWcRl 87 
                           k+++++D TLRDG        +l++ ++iA+ Ld+aGv+ +Ev             G pa ++ee   + i a+++++++a l+     
  JAGOAJ010000016.1_30   6 KKIILHDMTLRDGMHPKRHQITLDQMTSIARGLDEAGVPLIEVthgdglggasvnyGFPAHSDEEYlsAVIPAVKQAKISALLIP-GIG 93 
                           689***************************************9664444433333344555544431133444444333333322.223 PP

         nifV-07242025  88 resdieaaaalgvkrvdlsipvSdiqiaaklkrdrawvleeleelvklAldaglevsvGaEDaSRadeefllevaevaqeaGasrlRfa 176
                           + + +++a++lgv+++ ++    +               +  e+++++ ++ g++    +  a   +++ l++ a++ ++ Ga+ +  +
  JAGOAJ010000016.1_30  94 TVDHLRMAHDLGVSTIRVATHCTE--------------ADVSEQHISMGRKLGMDTVGFLMMAHMNSPQGLVTQAKLMESYGANCIYVT 168
                           333444444444444443332222..............334567899999999996444567888999********************* PP

         nifV-07242025 177 DTlGildPfttlekvkkLraald..lelEmHaHnDlGlAtANtlaavkaGathvnttvnGLGERAGnAaLeevvlalkrlygidtgidl 263
                           D  G + P t+ ++++++r+al+   +l +H H  l +  AN++aa++aGa  ++    GLG  AGn +Le +v a+  l+gi+tg+d+
  JAGOAJ010000016.1_30 169 DSAGHMLPATVKDRLQAVRDALQpeTQLGFHGHHNLAMGVANSIAAIEAGADRIDAAAAGLGAGAGNTPLEVLV-AVLDLMGIATGVDV 256
                           ********************9963367899****************************************8655.55567********* PP

         nifV-07242025 264 krlpelse 271
                            ++++++e
  JAGOAJ010000016.1_30 257 FKIQDVAE 264
                           99999886 PP

>> JAGOAJ010000006.1_143  # 132775 # 133728 # -1 # ID=27_143;partial=00;start_type=ATG;rbs_motif=AGGAG;rbs_spacer=5-10bp
   #    score  bias  c-Evalue  i-Evalue hmmfrom  hmm to    alifrom  ali to    envfrom  env to     acc
 ---   ------ ----- --------- --------- ------- -------    ------- -------    ------- -------    ----
   1 !   68.2   0.9   2.6e-22   1.2e-19      14     273 ..      11     289 ..       1     294 [. 0.83

  Alignments for each domain:
  == domain 1  score: 68.2 bits;  conditional E-value: 2.6e-22
          nifV-07242025  14 kavvinDtTLRDGeQaaGvaFsleeklaiAkaLdaaGveelEvG..ipamGeeereairaiaa..lglkakllaWcRlresdieaaaa 97 
                            ++v++    LRDG Q      s+e k++  +   aaGv+  E+G   pa    + +++r++ a  ++l+ +  a   l+e+ +e a +
  JAGOAJ010000006.1_143  11 DRVTLREVGLRDGLQLVRQFPSTEAKVEWLEREYAAGVRMFELGsfLPADKFPQFADVRQMIAaaKALPGASAAALTLNERGVEDALK 98 
                            579999999*******999889999*******************6669998888888887654113677777788899********** PP

          nifV-07242025  98 lgvkrvdlsipvSdiqiaaklkrdrawvle...eleelvklAlda......glevsvGaEDaSRadeefllevaevaqeaGasrlRfa 176
                            ++v+ + + +++ + + +a  +r+r+ +++   +++++ ++A  +      g++++ G+      d++ +l++ e+++ aGa  + +a
  JAGOAJ010000006.1_143  99 TEVDEIVFVVSATEGHSQANTRRSRQEAIDmvgRIAAMCNAAGPSapvltvGIAMAFGCSIEGDVDPTEVLRLLEACALAGADVVALA 186
                            *******************9998887766611155566666533234444488888899999999*********************** PP

          nifV-07242025 177 DTlGildPfttlekvkkLraal.dlelEmHaHnDlGlAtANtlaavkaGathvnttvnGLGE......RAGnAaLeevvlalkrlygi 257
                            DT+G   P ++ +   + r+a+ dl+l +H H+  G+A AN+ aa++aGa  ++  + GLG         Gn  +e++v   ++ +g+
  JAGOAJ010000006.1_143 187 DTVGYAGPQAVESLTLAARKAIgDLPLSLHFHDTRGMAIANAAAALNAGARILDGSLGGLGGcpfapgATGNVVFEDMVFLCES-MGY 273
                            **********99987777776548*************************************733333358********998777.9** PP

          nifV-07242025 258 dtgidlkrlpelselv 273
                            +tgid+++l  + el 
  JAGOAJ010000006.1_143 274 KTGIDINQLIGVRELL 289
                            ********98877665 PP

>> JAGOAJ010000012.1_57  # 52675 # 53583 # 1 # ID=44_57;partial=00;start_type=ATG;rbs_motif=AGGA;rbs_spacer=5-10bp;gc_co
   #    score  bias  c-Evalue  i-Evalue hmmfrom  hmm to    alifrom  ali to    envfrom  env to     acc
 ---   ------ ----- --------- --------- ------- -------    ------- -------    ------- -------    ----
   1 !   62.4   1.4   1.5e-20   6.8e-18      89     281 ..      84     288 ..       1     297 [. 0.80

  Alignments for each domain:
  == domain 1  score: 62.4 bits;  conditional E-value: 1.5e-20
         nifV-07242025  89 esdieaaaalgvkrvdlsipvSdiqiaaklkrdrawvleeleelvklAldaglev......svGaEDaSRadeefllevaevaqeaGas 171
                            +  eaa a gv+ v +  ++S+   ++ ++ + a  +++ + + ++A++agl++      ++G+        + +++v++  q++G+ 
  JAGOAJ010000012.1_57  84 LRGFEAALAAGVDEVVIFGAASEAFSQKNINCSIAESIDRFQPVAQAAKAAGLRLrasiscALGCPYQGEVPIAAVIDVVQRMQALGVD 172
                           556789999********99****999999998888999999999999999987542222226899999999999*************** PP

         nifV-07242025 172 rlRfaDTlGildPfttlekvkkLraaldle.lEmHaHnDlGlAtANtlaavkaGathvnttvnGLGE......RAGnAaLeevvlalkr 253
                            + +aDT+G+  P+++ + ++++++ ++ + +  H H+ +G A AN +aa+ aG+    t v GLG         Gn a e+v   l+ 
  JAGOAJ010000012.1_57 173 EFDIADTIGVGTPLKVGKVMRAVTDIIPANrVAGHFHDTYGQALANIVAAMDAGVAIFHTSVAGLGGcpyakgATGNVATEDVLYMLHG 261
                           *************************998753999********************************633333357*********99998 PP

         nifV-07242025 254 lygidtgidlkrlpelselvakasgrpv 281
                            +gi+tgi+l+++ ++ + +++  gr+ 
  JAGOAJ010000012.1_57 262 -MGIHTGINLDAVVDIGQWISAHLGRKA 288
                           .9***************99998777765 PP

>> JAGOAJ010000015.1_7  # 5731 # 6636 # -1 # ID=56_7;partial=00;start_type=ATG;rbs_motif=None;rbs_spacer=None;gc_cont=0.
   #    score  bias  c-Evalue  i-Evalue hmmfrom  hmm to    alifrom  ali to    envfrom  env to     acc
 ---   ------ ----- --------- --------- ------- -------    ------- -------    ------- -------    ----
   1 !   56.1   1.9   1.2e-18   5.4e-16      15     282 ..       5     288 ..       1     296 [. 0.84

  Alignments for each domain:
  == domain 1  score: 56.1 bits;  conditional E-value: 1.2e-18
        nifV-07242025  15 avvinDtTLRDGeQaaGvaFsleeklaiAkaLdaaGveelEv.......GipamGeeereairaiaalglkakllaWcRlresdieaaaa 97 
                          +v++     RDG Q     +s+e k+++ ++  +aG++ +E         +p m ++e+  ++  + +g++ + la   l+ +  + a++
  JAGOAJ010000015.1_7   5 QVTLIEVGPRDGLQNEPEVLSTERKIELISHAIKAGLQRIEAvsfvnprRVPQMADAEAVMLAVPRPAGVRYSGLA---LNLRGAQRAVD 91 
                          57777777799999999999*******9999999*******73333433489999999888887788777777766...56778899*** PP

        nifV-07242025  98 lgvkrvdlsipvSdiqiaaklkrdrawvleeleelvklAldaglevsv......GaEDaSRadeefllevaevaqeaGasrlRfaDTlGi 181
                           gv+ ++  + +Sd+  +a  +  ++++l+  e++ +lA+++g+  ++      G+        + + ++a+ a+e+Ga  + +aD +G+
  JAGOAJ010000015.1_7  92 AGVHEINYVVVASDTYNQANQGCPTQVTLDAWEHVAELAQRHGIGCTLtiaaafGCPFEGEVPINRVSQIAAKAAELGADEIVLADSIGV 181
                          **********************9999**************99875544111111666667778899************************ PP

        nifV-07242025 182 ldPfttlekvkkLraald.lelEmHaHnDlGlAtANtlaavkaGathvnttvnGLGE......RAGnAaLeevvlalkrlygidtgidlk 264
                            Pf ++++++++r+a++   l  H Hn      AN  aa+++G+t  +  + G+G         Gn + e+v+  l+r +g+  g++l+
  JAGOAJ010000015.1_7 182 ASPFDVTARIAAVRQAVPdAILRCHFHNTRNTGLANVAAAIQSGVTLFDAAIGGIGGcpfapgATGNIPTEDVAYMLDR-MGMLKGVSLE 270
                          ***************996255799****9999999*********************733333358**************.89999***** PP

        nifV-07242025 265 rlpelselvakasgrpvp 282
                          +l +  +  +++ grpvp
  JAGOAJ010000015.1_7 271 ALIDAGQWLTDTLGRPVP 288
                          ****99999999999997 PP



Internal pipeline statistics summary:
-------------------------------------
Query model(s):                            1  (437 nodes)
Target sequences:                       3172  (1028376 residues searched)
Passed MSV filter:                       125  (0.0394073); expected 63.4 (0.02)
Passed bias filter:                       70  (0.0220681); expected 63.4 (0.02)
Passed Vit filter:                        14  (0.00441362); expected 3.2 (0.001)
Passed Fwd filter:                         7  (0.00220681); expected 0.0 (1e-05)
Initial search space (Z):               3172  [actual number of targets]
Domain search space  (domZ):               7  [number of targets reported over threshold]
# CPU time: 0.06u 0.00s 00:00:00.06 Elapsed: 00:00:00.08
# Mc/sec: 5498.54
//
[ok]
