# hmmsearch :: search profile(s) against a sequence database
# HMMER 3.4 (Aug 2023); http://hmmer.org/
# Copyright (C) 2023 Howard Hughes Medical Institute.
# Freely distributed under the BSD open source license.
# - - - - - - - - - - - - - - - - - - - - - - - - - - - - - - - - - - - -
# query HMM file:                  ../HMMs/combined_nif_04012025.hmm
# target sequence database:        ../all_rep_proteins_aa/bacteria/GB_GCA_022448455.1_protein.faa
# - - - - - - - - - - - - - - - - - - - - - - - - - - - - - - - - - - - -

Query:       nifH-03292025  [M=327]
Scores for complete sequences (score includes all domains):
   --- full sequence ---   --- best 1 domain ---    -#dom-
    E-value  score  bias    E-value  score  bias    exp  N  Sequence              Description
    ------- ------ -----    ------- ------ -----   ---- --  --------              -----------
    2.7e-07   26.7   0.1    4.6e-06   22.6   0.1    2.3  2  JAKUUR010000001.1_116  # 118310 # 119392 # 1 # ID=1_116;parti


Domain annotation for each sequence (and alignments):
>> JAKUUR010000001.1_116  # 118310 # 119392 # 1 # ID=1_116;partial=00;start_type=TTG;rbs_motif=GGAG/GAGG;rbs_spacer=5-10
   #    score  bias  c-Evalue  i-Evalue hmmfrom  hmm to    alifrom  ali to    envfrom  env to     acc
 ---   ------ ----- --------- --------- ------- -------    ------- -------    ------- -------    ----
   1 !   22.6   0.1   2.7e-09   4.6e-06      15      42 ..     105     132 ..      96     145 .. 0.89
   2 !    1.4   0.0    0.0079        14     205     253 ..     293     341 ..     235     352 .. 0.78

  Alignments for each domain:
  == domain 1  score: 22.6 bits;  conditional E-value: 2.7e-09
          nifH-03292025  15 YGKGGiGKSttasnlsaalaeegkkvli 42 
                             GKGG+GKStta nl+ al +eg kv  
  JAKUUR010000001.1_116 105 SGKGGVGKSTTAVNLALALHSEGAKVAL 132
                            4************************965 PP

  == domain 2  score: 1.4 bits;  conditional E-value: 0.0079
          nifH-03292025 205 aeklgtqiiafvprsnevqkaelekktvieaapdseqakeyreLakkil 253
                            a + +t+ +  +p +  +++   e+k ++ ++p+s++ + y+e+a+k +
  JAKUUR010000001.1_116 293 ALDSETNFLGALPLQLDIRTDVDEGKPTVIKSPESKASQIYQEIARKTA 341
                            555666666667766666665556666666789************9976 PP



Internal pipeline statistics summary:
-------------------------------------
Query model(s):                            1  (327 nodes)
Target sequences:                       1724  (528027 residues searched)
Passed MSV filter:                        95  (0.0551044); expected 34.5 (0.02)
Passed bias filter:                       63  (0.0365429); expected 34.5 (0.02)
Passed Vit filter:                        14  (0.00812065); expected 1.7 (0.001)
Passed Fwd filter:                         1  (0.000580046); expected 0.0 (1e-05)
Initial search space (Z):               1724  [actual number of targets]
Domain search space  (domZ):               1  [number of targets reported over threshold]
# CPU time: 0.02u 0.00s 00:00:00.02 Elapsed: 00:00:00.01
# Mc/sec: 13142.73
//
Query:       nifD-03292025  [M=482]
Scores for complete sequences (score includes all domains):
   --- full sequence ---   --- best 1 domain ---    -#dom-
    E-value  score  bias    E-value  score  bias    exp  N  Sequence Description
    ------- ------ -----    ------- ------ -----   ---- --  -------- -----------

   [No hits detected that satisfy reporting thresholds]


Domain annotation for each sequence (and alignments):

   [No targets detected that satisfy reporting thresholds]


Internal pipeline statistics summary:
-------------------------------------
Query model(s):                            1  (482 nodes)
Target sequences:                       1724  (528027 residues searched)
Passed MSV filter:                        74  (0.0429234); expected 34.5 (0.02)
Passed bias filter:                       52  (0.0301624); expected 34.5 (0.02)
Passed Vit filter:                         6  (0.00348028); expected 1.7 (0.001)
Passed Fwd filter:                         0  (0); expected 0.0 (1e-05)
Initial search space (Z):               1724  [actual number of targets]
Domain search space  (domZ):               0  [number of targets reported over threshold]
# CPU time: 0.02u 0.00s 00:00:00.02 Elapsed: 00:00:00.01
# Mc/sec: 25107.37
//
Query:       nifK-03292025  [M=490]
Scores for complete sequences (score includes all domains):
   --- full sequence ---   --- best 1 domain ---    -#dom-
    E-value  score  bias    E-value  score  bias    exp  N  Sequence Description
    ------- ------ -----    ------- ------ -----   ---- --  -------- -----------

   [No hits detected that satisfy reporting thresholds]


Domain annotation for each sequence (and alignments):

   [No targets detected that satisfy reporting thresholds]


Internal pipeline statistics summary:
-------------------------------------
Query model(s):                            1  (490 nodes)
Target sequences:                       1724  (528027 residues searched)
Passed MSV filter:                        53  (0.0307425); expected 34.5 (0.02)
Passed bias filter:                       38  (0.0220418); expected 34.5 (0.02)
Passed Vit filter:                         1  (0.000580046); expected 1.7 (0.001)
Passed Fwd filter:                         0  (0); expected 0.0 (1e-05)
Initial search space (Z):               1724  [actual number of targets]
Domain search space  (domZ):               0  [number of targets reported over threshold]
# CPU time: 0.02u 0.00s 00:00:00.02 Elapsed: 00:00:00.00
# Mc/sec: 30332.39
//
Query:       nifB-03292025  [M=505]
Scores for complete sequences (score includes all domains):
   --- full sequence ---   --- best 1 domain ---    -#dom-
    E-value  score  bias    E-value  score  bias    exp  N  Sequence             Description
    ------- ------ -----    ------- ------ -----   ---- --  --------             -----------
    1.6e-08   30.1   0.6    1.9e-07   26.5   0.6    2.3  1  JAKUUR010000010.1_25  # 28467 # 29462 # -1 # ID=2_25;partial=


Domain annotation for each sequence (and alignments):
>> JAKUUR010000010.1_25  # 28467 # 29462 # -1 # ID=2_25;partial=00;start_type=ATG;rbs_motif=GGA/GAG/AGG;rbs_spacer=5-10b
   #    score  bias  c-Evalue  i-Evalue hmmfrom  hmm to    alifrom  ali to    envfrom  env to     acc
 ---   ------ ----- --------- --------- ------- -------    ------- -------    ------- -------    ----
   1 !   26.5   0.6   1.1e-10   1.9e-07      75     261 ..      11     175 ..       7     194 .. 0.76

  Alignments for each domain:
  == domain 1  score: 26.5 bits;  conditional E-value: 1.1e-10
         nifB-03292025  75 kfaRmHvavApaCNiqCnyCnRkydCanEsRPGvvsevLtpeqavkkvkavaaeipqlsVvGiAGPGDalanpektfetlelvkeeapd 163
                           +++ + v+v   CN  C+yC+ +   +        sevL+ e+ vk v   a+ +  ++ v + G G++l   +  +  l+++  ++p 
  JAKUUR010000010.1_25  11 HITYLRVSVTDHCNYRCHYCRDEDHQTH----TTRSEVLSFEEIVKIVGLFAE-LG-VTKVRLTG-GEPLLRKD--ILDLARMLGDIPG 90 
                           45567899************76544444....45599*****98776655544.33.33444555.99**9655..6778888889999 PP

         nifB-03292025 164 lk.lClstNGLaLpeyvdelaelnvdhvtvTiNavdpeigakiypwvlyekkrytgeeaaeiLlerQlegleklaergvl.vKvNsvli 250
                           l+ + lstN   Lp+ + +l++++++ v + i ++ pe  +    +++ ++      +     l+r ++g+++ +++g+  +K+N v++
  JAKUUR010000010.1_25  91 LTdIPLSTNAHLLPSLAGKLKSHGINRVNISIDSLIPERFK----EITRDG------D-----LARVIKGIDAAIAAGMSpIKLNMVVM 164
                           86378***************************999995433....333222......2.....4567899999999999659******* PP

         nifB-03292025 251 pgvNdehlvev 261
                           +gvNde++  +
  JAKUUR010000010.1_25 165 KGVNDEEIESM 175
                           ******99865 PP



Internal pipeline statistics summary:
-------------------------------------
Query model(s):                            1  (505 nodes)
Target sequences:                       1724  (528027 residues searched)
Passed MSV filter:                        58  (0.0336427); expected 34.5 (0.02)
Passed bias filter:                       44  (0.025522); expected 34.5 (0.02)
Passed Vit filter:                         7  (0.00406032); expected 1.7 (0.001)
Passed Fwd filter:                         1  (0.000580046); expected 0.0 (1e-05)
Initial search space (Z):               1724  [actual number of targets]
Domain search space  (domZ):               1  [number of targets reported over threshold]
# CPU time: 0.02u 0.00s 00:00:00.02 Elapsed: 00:00:00.02
# Mc/sec: 10089.13
//
Query:       nifE-03292025  [M=556]
Scores for complete sequences (score includes all domains):
   --- full sequence ---   --- best 1 domain ---    -#dom-
    E-value  score  bias    E-value  score  bias    exp  N  Sequence             Description
    ------- ------ -----    ------- ------ -----   ---- --  --------             -----------
    2.4e-05   19.6   0.0    3.2e-05   19.2   0.0    1.1  1  JAKUUR010000002.1_14  # 12639 # 13667 # 1 # ID=12_14;partial=


Domain annotation for each sequence (and alignments):
>> JAKUUR010000002.1_14  # 12639 # 13667 # 1 # ID=12_14;partial=00;start_type=ATG;rbs_motif=GGA/GAG/AGG;rbs_spacer=5-10b
   #    score  bias  c-Evalue  i-Evalue hmmfrom  hmm to    alifrom  ali to    envfrom  env to     acc
 ---   ------ ----- --------- --------- ------- -------    ------- -------    ------- -------    ----
   1 !   19.2   0.0   1.9e-08   3.2e-05     320     396 ..     139     213 ..     131     266 .. 0.79

  Alignments for each domain:
  == domain 1  score: 19.2 bits;  conditional E-value: 1.9e-08
         nifE-03292025 320 eraealiaeeearvekeleeyrkrLkGkkallytggvkawslvsalrelGmevvatgtkksteedkerikellgedk 396
                           + + ++ia+++++ ++ l  y + +kGk+ l+   g+  +s+ +  + lGm+v++++ + +t ed  +++++ + d+
  JAKUUR010000002.1_14 139 THMPQIIANQHNNHWESL--YSTLIKGKTLLVIGVGNIGYSVTKKCKALGMNVIGVSRHGKTLEDVDEMVSADQLDE 213
                           556789999999999998..7899******************************************99988544444 PP



Internal pipeline statistics summary:
-------------------------------------
Query model(s):                            1  (556 nodes)
Target sequences:                       1724  (528027 residues searched)
Passed MSV filter:                        70  (0.0406032); expected 34.5 (0.02)
Passed bias filter:                       52  (0.0301624); expected 34.5 (0.02)
Passed Vit filter:                         3  (0.00174014); expected 1.7 (0.001)
Passed Fwd filter:                         1  (0.000580046); expected 0.0 (1e-05)
Initial search space (Z):               1724  [actual number of targets]
Domain search space  (domZ):               1  [number of targets reported over threshold]
# CPU time: 0.02u 0.00s 00:00:00.02 Elapsed: 00:00:00.01
# Mc/sec: 22250.34
//
Query:       nifN-03292025  [M=700]
Scores for complete sequences (score includes all domains):
   --- full sequence ---   --- best 1 domain ---    -#dom-
    E-value  score  bias    E-value  score  bias    exp  N  Sequence Description
    ------- ------ -----    ------- ------ -----   ---- --  -------- -----------

   [No hits detected that satisfy reporting thresholds]


Domain annotation for each sequence (and alignments):

   [No targets detected that satisfy reporting thresholds]


Internal pipeline statistics summary:
-------------------------------------
Query model(s):                            1  (700 nodes)
Target sequences:                       1724  (528027 residues searched)
Passed MSV filter:                        76  (0.0440835); expected 34.5 (0.02)
Passed bias filter:                       58  (0.0336427); expected 34.5 (0.02)
Passed Vit filter:                         7  (0.00406032); expected 1.7 (0.001)
Passed Fwd filter:                         0  (0); expected 0.0 (1e-05)
Initial search space (Z):               1724  [actual number of targets]
Domain search space  (domZ):               0  [number of targets reported over threshold]
# CPU time: 0.02u 0.00s 00:00:00.02 Elapsed: 00:00:00.01
# Mc/sec: 25088.84
//
Query:       pchlide-04012025  [M=508]
Scores for complete sequences (score includes all domains):
   --- full sequence ---   --- best 1 domain ---    -#dom-
    E-value  score  bias    E-value  score  bias    exp  N  Sequence Description
    ------- ------ -----    ------- ------ -----   ---- --  -------- -----------

   [No hits detected that satisfy reporting thresholds]


Domain annotation for each sequence (and alignments):

   [No targets detected that satisfy reporting thresholds]


Internal pipeline statistics summary:
-------------------------------------
Query model(s):                            1  (508 nodes)
Target sequences:                       1724  (528027 residues searched)
Passed MSV filter:                        69  (0.0400232); expected 34.5 (0.02)
Passed bias filter:                       62  (0.0359629); expected 34.5 (0.02)
Passed Vit filter:                         4  (0.00232019); expected 1.7 (0.001)
Passed Fwd filter:                         0  (0); expected 0.0 (1e-05)
Initial search space (Z):               1724  [actual number of targets]
Domain search space  (domZ):               0  [number of targets reported over threshold]
# CPU time: 0.01u 0.00s 00:00:00.01 Elapsed: 00:00:00.00
# Mc/sec: 27692.02
//
[ok]
# hmmsearch :: search profile(s) against a sequence database
# HMMER 3.4 (Aug 2023); http://hmmer.org/
# Copyright (C) 2023 Howard Hughes Medical Institute.
# Freely distributed under the BSD open source license.
# - - - - - - - - - - - - - - - - - - - - - - - - - - - - - - - - - - - -
# query HMM file:                  ../HMMs/nifV_07242025.hmm
# target sequence database:        ../all_rep_proteins_aa/bacteria/GB_GCA_022448455.1_protein.faa
# - - - - - - - - - - - - - - - - - - - - - - - - - - - - - - - - - - - -

Query:       nifV-07242025  [M=437]
Scores for complete sequences (score includes all domains):
   --- full sequence ---   --- best 1 domain ---    -#dom-
    E-value  score  bias    E-value  score  bias    exp  N  Sequence             Description
    ------- ------ -----    ------- ------ -----   ---- --  --------             -----------
    3.4e-96  319.5   0.0    4.5e-96  319.1   0.0    1.0  1  JAKUUR010000053.1_4   # 1221 # 2390 # -1 # ID=49_4;partial=00
    8.8e-96  318.2   8.3    1.1e-95  317.9   8.3    1.0  1  JAKUUR010000008.1_52  # 46591 # 48123 # -1 # ID=69_52;partial
    2.3e-18   63.0   0.0    1.8e-16   56.8   0.0    2.3  3  JAKUUR010000019.1_5   # 3758 # 5560 # -1 # ID=11_5;partial=00


Domain annotation for each sequence (and alignments):
>> JAKUUR010000053.1_4  # 1221 # 2390 # -1 # ID=49_4;partial=00;start_type=ATG;rbs_motif=None;rbs_spacer=None;gc_cont=0.
   #    score  bias  c-Evalue  i-Evalue hmmfrom  hmm to    alifrom  ali to    envfrom  env to     acc
 ---   ------ ----- --------- --------- ------- -------    ------- -------    ------- -------    ----
   1 !  319.1   0.0   7.8e-99   4.5e-96      12     361 ..      17     365 ..       6     370 .. 0.97

  Alignments for each domain:
  == domain 1  score: 319.1 bits;  conditional E-value: 7.8e-99
        nifV-07242025  12 kakavvinDtTLRDGeQaaGvaFsleeklaiAkaLdaaGveelEvGipamGeeereairaiaalglkakllaWcRlresdieaaaalgvk 101
                          + k++ i D+TLR+GeQ +Gv+F+++++++iA  Ld  Gv+++E+  p ++++ +ea ++i ++gl+a+++a  R+ ++di+ + +++ +
  JAKUUR010000053.1_4  17 EPKKIRILDSTLREGEQHPGVSFTVKQRIQIAWELDYFGVDQIEIS-PIISNDHAEATKTIIKQGLRADIVAHGRALKDDIDISLKCDAS 105
                          3478*****************************************5.******************************************* PP

        nifV-07242025 102 rvdlsipvSdiqiaaklkrdrawvleeleelvklAldaglevsvGaEDaSRadeefllevaevaqeaGasrlRfaDTlGildPfttlekv 191
                          +v   + +Sdi+++ kl+ +r+++l++  ++v++A+++gl++   +ED SRad++fl++v ++ ++aG+ r+ + DT+Gil P+ +++ v
  JAKUUR010000053.1_4 106 WVAAYLGISDIHLKDKLRISREQALDRAVQTVEYAKSHGLKIRFTVEDGSRADPQFLINVCKAIEDAGVDRISLPDTVGILRPIGMYNFV 195
                          ****************************************************************************************** PP

        nifV-07242025 192 kkLraaldlelEmHaHnDlGlAtANtlaavkaGathvnttvnGLGERAGnAaLeevvlalkrlygidtgidlkrlpelselvakasgrpv 281
                          kk+r++++ +l+ H HnD+G+A AN++aa+ aGa ++ tt+ G+GER G  +L e ++al+ ly+   + +l+ l +ls+l+++ +  + 
  JAKUUR010000053.1_4 196 KKVRSEIKTPLDAHVHNDIGFALANAFAACDAGADQIHTTIDGIGERTGIPSLAETAVALTYLYKSPNDFRLDMLADLSRLIEQYTDIRP 285
                          ****************************************************************************************** PP

        nifV-07242025 282 paqkaivGeavFtHEsGiHvdgllkdpetYegldPeevGrerrlvlGkhsGraavkaalaelgieldeeeaealleavre 361
                            +k+ivG+++++H +G H +++l++p+ Ye+++P+ vG +rr+v G  +G+++ + +++ lg++ d+++a+++ + +++
  JAKUUR010000053.1_4 286 YDSKPIVGSSAYKHKAGTHLAAVLRNPAAYEPINPRMVGNRRRIVFGELAGKTGAEYLMSLLGMKKDTDNAKNIAAGLKN 365
                          ************************************************************************99988876 PP

>> JAKUUR010000008.1_52  # 46591 # 48123 # -1 # ID=69_52;partial=00;start_type=ATG;rbs_motif=AGGAG;rbs_spacer=5-10bp;gc_
   #    score  bias  c-Evalue  i-Evalue hmmfrom  hmm to    alifrom  ali to    envfrom  env to     acc
 ---   ------ ----- --------- --------- ------- -------    ------- -------    ------- -------    ----
   1 !  317.9   8.3   1.9e-98   1.1e-95      15     399 ..       4     401 ..       1     440 [. 0.86

  Alignments for each domain:
  == domain 1  score: 317.9 bits;  conditional E-value: 1.9e-98
         nifV-07242025  15 avvinDtTLRDGeQaaGvaFsleeklaiAkaLdaaGveelEvGipamGeeereairaiaalglkakllaWcRlresdieaa....aalg 99 
                           +++i DtTLRDGeQ++G +++ +ek++iAk L+++ v+ +E G +  ++ + ea++a+a++  ++++ + +R+ ++di+ a    ++++
  JAKUUR010000008.1_52   4 KLIIFDTTLRDGEQSPGASMTKDEKVRIAKILEKMRVDVIEAGFAIASQGDFEAVQAVAKAVKDSTVCSLARALDKDIDRAgeaiKNTN 92 
                           689*********************************************************8778**************87633335789 PP

         nifV-07242025 100 vkrvdlsipvSdiqiaaklkrdrawvleeleelvklAldaglevsvGaEDaSRadeefllevaevaqeaGasrlRfaDTlGildPfttl 188
                             r++  i++Sdi+++ kl+ + + v+++  ++vk+A++   ++    EDa R+d +fl++++e+a +aGa+ + + DT+G   P +  
  JAKUUR010000008.1_52  93 SARIHTFIATSDIHMQMKLRMTPDEVVSQAVRSVKRATKFTNNIEFSPEDAGRSDIDFLCRIIEAAIDAGATTINIPDTVGYNIPHQFG 181
                           99******************99999*************************************************************999 PP

         nifV-07242025 189 ekvkkLraaldle....lEmHaHnDlGlAtANtlaavkaGathvnttvnGLGERAGnAaLeevvlalkr...lygidtgidlkrlpels 270
                           e++++L ++++ +    +  H+HnDlGlA +N+l av  Ga +v+ t+nGLGERAGn +Leevv+a+++   + g+dt+id+k++ + s
  JAKUUR010000008.1_52 182 ETMRELIERVPNSdkaiFSAHCHNDLGLAVSNSLSAVLNGARQVECTINGLGERAGNTSLEEVVMAVRTrqdVFGCDTNIDTKNILAAS 270
                           99999998876432222789***********************************************862225789************* PP

         nifV-07242025 271 elvakasgrpvpaqkaivGeavFtHEsGiHvdgllkdpetYegldPeevGre.rrlvlGkhsGraavkaalaelgielde.eeaealle 357
                           +lv++ +g  v+++kaivG+++F+HE+GiH dg+lk++etYe ++ e+vG++ ++lv+GkhsGr+a +  ++elg+e d+ +e+++  +
  JAKUUR010000008.1_52 271 RLVSSITGFVVQPNKAIVGANAFAHEAGIHQDGILKHRETYEIMKAEDVGWHaNTLVMGKHSGRNAFRVRMRELGVEFDSdDELNNAFS 359
                           **************************************************97357**********************986157888888 PP

         nifV-07242025 358 avrelaeetkrslteeeLlelveellaa.eeaakaaakakaaa 399
                           + ++la ++k+ + +e+L++lv+e++a+ +e+ + ++ + +++
  JAKUUR010000008.1_52 360 RFKALA-DKKHDIFDEDLQALVTEAQAEaTEVIRLISLKVCTE 401
                           888776.5789999*********97643133333322222222 PP

>> JAKUUR010000019.1_5  # 3758 # 5560 # -1 # ID=11_5;partial=00;start_type=ATG;rbs_motif=GGAG/GAGG;rbs_spacer=5-10bp;gc_
   #    score  bias  c-Evalue  i-Evalue hmmfrom  hmm to    alifrom  ali to    envfrom  env to     acc
 ---   ------ ----- --------- --------- ------- -------    ------- -------    ------- -------    ----
   1 !    3.7   0.0    0.0042       2.4      11      55 ..       6      51 ..       1      84 [. 0.82
   2 ?   -3.7   0.0      0.73   4.2e+02     176     207 ..     113     145 ..     111     147 .. 0.79
   3 !   56.8   0.0   3.2e-19   1.8e-16     159     271 ..     164     275 ..     156     288 .. 0.95

  Alignments for each domain:
  == domain 1  score: 3.7 bits;  conditional E-value: 0.0042
        nifV-07242025 11 kkakavvinDtTLRDGeQaa.GvaFsleeklaiAkaLdaaGveelE 55
                         ++++ v i+   LRD  Q+     +++++ l iA++Ld++G   +E
  JAKUUR010000019.1_5  6 ENTSPVEITELVLRDAHQSLfATRMRIDDMLPIAEKLDQIGYWSME 51
                         3447899***********963667999**************98888 PP

  == domain 2  score: -3.7 bits;  conditional E-value: 0.73
        nifV-07242025 176 aD.TlGildPfttlekvkkLraaldlelEmHaH 207
                          aD  +Gi+  f +++ +++L +a++  + +  H
  JAKUUR010000019.1_5 113 ADnGVGIFRIFDAMNDMRNLETAINQTVKIGQH 145
                          553599999999999999999999888877666 PP

  == domain 3  score: 56.8 bits;  conditional E-value: 3.2e-19
        nifV-07242025 159 levaevaqeaGasrlRfaDTlGildPfttlekvkkLraaldlelEmHaHnDlGlAtANtlaavkaGathvnttvnGLGERAGnAaLeevv 248
                          +e+a+  +++Ga+ l + D  G+l+P  +++ vkkL++a+d+++ +HaH   Gl+tA  + av+aG+  v+t +  +    G  a + vv
  JAKUUR010000019.1_5 164 VEMAKKIEDMGAHSLCIKDMAGLLQPYVAYDLVKKLKNAIDIPIQLHAHATTGLSTACIIKAVEAGVDRVDTSIGSMSMTYGHSATNSVV 253
                          6899999*********************************************************************************** PP

        nifV-07242025 249 lalkrlygidtgidlkrlpelse 271
                            l++    +tg+dlk+l+e+ +
  JAKUUR010000019.1_5 254 SILEH-GPRKTGLDLKKLEEVDQ 275
                          *****.889*********99866 PP



Internal pipeline statistics summary:
-------------------------------------
Query model(s):                            1  (437 nodes)
Target sequences:                       1724  (528027 residues searched)
Passed MSV filter:                        56  (0.0324826); expected 34.5 (0.02)
Passed bias filter:                       47  (0.0272622); expected 34.5 (0.02)
Passed Vit filter:                         4  (0.00232019); expected 1.7 (0.001)
Passed Fwd filter:                         3  (0.00174014); expected 0.0 (1e-05)
Initial search space (Z):               1724  [actual number of targets]
Domain search space  (domZ):               3  [number of targets reported over threshold]
# CPU time: 0.02u 0.00s 00:00:00.02 Elapsed: 00:00:00.02
# Mc/sec: 8911.55
//
[ok]
