# hmmsearch :: search profile(s) against a sequence database
# HMMER 3.4 (Aug 2023); http://hmmer.org/
# Copyright (C) 2023 Howard Hughes Medical Institute.
# Freely distributed under the BSD open source license.
# - - - - - - - - - - - - - - - - - - - - - - - - - - - - - - - - - - - -
# query HMM file:                  ../HMMs/combined_nif_04012025.hmm
# target sequence database:        ../all_rep_proteins_aa/bacteria/GB_GCA_947628595.1_protein.faa
# - - - - - - - - - - - - - - - - - - - - - - - - - - - - - - - - - - - -

Query:       nifH-03292025  [M=327]
Scores for complete sequences (score includes all domains):
   --- full sequence ---   --- best 1 domain ---    -#dom-
    E-value  score  bias    E-value  score  bias    exp  N  Sequence            Description
    ------- ------ -----    ------- ------ -----   ---- --  --------            -----------
    5.1e-08   28.7   0.4    8.6e-08   27.9   0.4    1.4  1  CANRAN010000002.1_6  # 4961 # 5695 # 1 # ID=2_6;partial=00;st


Domain annotation for each sequence (and alignments):
>> CANRAN010000002.1_6  # 4961 # 5695 # 1 # ID=2_6;partial=00;start_type=ATG;rbs_motif=GGAG/GAGG;rbs_spacer=5-10bp;gc_co
   #    score  bias  c-Evalue  i-Evalue hmmfrom  hmm to    alifrom  ali to    envfrom  env to     acc
 ---   ------ ----- --------- --------- ------- -------    ------- -------    ------- -------    ----
   1 !   27.9   0.4   6.5e-11   8.6e-08      15      56 ..       9      50 ..       1      72 [. 0.81

  Alignments for each domain:
  == domain 1  score: 27.9 bits;  conditional E-value: 6.5e-11
        nifH-03292025 15 YGKGGiGKSttasnlsaalaeegkkvlivGCdPKaDstrlll 56
                          GKGG GKSt a+ l aal ++g++vli+ Cd     + l+l
  CANRAN010000002.1_6  9 SGKGGTGKSTLAAGLGAALVRRGNRVLIIDCDAGMRGVDLML 50
                         5*******************************7666666665 PP



Internal pipeline statistics summary:
-------------------------------------
Query model(s):                            1  (327 nodes)
Target sequences:                       1329  (399156 residues searched)
Passed MSV filter:                       106  (0.0797592); expected 26.6 (0.02)
Passed bias filter:                       68  (0.0511663); expected 26.6 (0.02)
Passed Vit filter:                        15  (0.0112867); expected 1.3 (0.001)
Passed Fwd filter:                         1  (0.000752445); expected 0.0 (1e-05)
Initial search space (Z):               1329  [actual number of targets]
Domain search space  (domZ):               1  [number of targets reported over threshold]
# CPU time: 0.01u 0.00s 00:00:00.01 Elapsed: 00:00:00.01
# Mc/sec: 9846.66
//
Query:       nifD-03292025  [M=482]
Scores for complete sequences (score includes all domains):
   --- full sequence ---   --- best 1 domain ---    -#dom-
    E-value  score  bias    E-value  score  bias    exp  N  Sequence Description
    ------- ------ -----    ------- ------ -----   ---- --  -------- -----------

   [No hits detected that satisfy reporting thresholds]


Domain annotation for each sequence (and alignments):

   [No targets detected that satisfy reporting thresholds]


Internal pipeline statistics summary:
-------------------------------------
Query model(s):                            1  (482 nodes)
Target sequences:                       1329  (399156 residues searched)
Passed MSV filter:                        85  (0.0639579); expected 26.6 (0.02)
Passed bias filter:                       41  (0.0308503); expected 26.6 (0.02)
Passed Vit filter:                         7  (0.00526712); expected 1.3 (0.001)
Passed Fwd filter:                         0  (0); expected 0.0 (1e-05)
Initial search space (Z):               1329  [actual number of targets]
Domain search space  (domZ):               0  [number of targets reported over threshold]
# CPU time: 0.01u 0.00s 00:00:00.01 Elapsed: 00:00:00.01
# Mc/sec: 14257.66
//
Query:       nifK-03292025  [M=490]
Scores for complete sequences (score includes all domains):
   --- full sequence ---   --- best 1 domain ---    -#dom-
    E-value  score  bias    E-value  score  bias    exp  N  Sequence Description
    ------- ------ -----    ------- ------ -----   ---- --  -------- -----------

   [No hits detected that satisfy reporting thresholds]


Domain annotation for each sequence (and alignments):

   [No targets detected that satisfy reporting thresholds]


Internal pipeline statistics summary:
-------------------------------------
Query model(s):                            1  (490 nodes)
Target sequences:                       1329  (399156 residues searched)
Passed MSV filter:                        44  (0.0331076); expected 26.6 (0.02)
Passed bias filter:                       24  (0.0180587); expected 26.6 (0.02)
Passed Vit filter:                         3  (0.00225734); expected 1.3 (0.001)
Passed Fwd filter:                         0  (0); expected 0.0 (1e-05)
Initial search space (Z):               1329  [actual number of targets]
Domain search space  (domZ):               0  [number of targets reported over threshold]
# CPU time: 0.01u 0.00s 00:00:00.01 Elapsed: 00:00:00.01
# Mc/sec: 18764.39
//
Query:       nifB-03292025  [M=505]
Scores for complete sequences (score includes all domains):
   --- full sequence ---   --- best 1 domain ---    -#dom-
    E-value  score  bias    E-value  score  bias    exp  N  Sequence            Description
    ------- ------ -----    ------- ------ -----   ---- --  --------            -----------
    6.6e-05   17.8   0.0    0.00011   17.1   0.0    1.4  1  CANRAN010000051.1_1  # 322 # 636 # 1 # ID=51_1;partial=00;sta


Domain annotation for each sequence (and alignments):
>> CANRAN010000051.1_1  # 322 # 636 # 1 # ID=51_1;partial=00;start_type=ATG;rbs_motif=GGAGG;rbs_spacer=5-10bp;gc_cont=0.
   #    score  bias  c-Evalue  i-Evalue hmmfrom  hmm to    alifrom  ali to    envfrom  env to     acc
 ---   ------ ----- --------- --------- ------- -------    ------- -------    ------- -------    ----
   1 !   17.1   0.0   8.1e-08   0.00011     380     468 ..       8      86 ..       1     100 [. 0.79

  Alignments for each domain:
  == domain 1  score: 17.1 bits;  conditional E-value: 8.1e-08
        nifB-03292025 380 skggkrvnqHFGhakefliyevsekevklveerkvekyCkggegceeeedrleeilkalsdceavlcakiGeepkekLeeagieaveae 468
                           k+ + +n+ F  a +f iye+++ e+++ e  ++    kg+ +       +   +  + +++av+c++i e+  e+L+++gi+ ++ +
  CANRAN010000051.1_1   8 DKNSGLINNDFETAGHFKIYEIENGEISYSEILSTM---KGDID-------MVVGMLCMFEVDAVFCNNIKETTMENLSSEGIHFYKGQ 86 
                          578899**********************99988773...34433.......4444455678**********************987755 PP



Internal pipeline statistics summary:
-------------------------------------
Query model(s):                            1  (505 nodes)
Target sequences:                       1329  (399156 residues searched)
Passed MSV filter:                        51  (0.0383747); expected 26.6 (0.02)
Passed bias filter:                       29  (0.0218209); expected 26.6 (0.02)
Passed Vit filter:                         2  (0.00150489); expected 1.3 (0.001)
Passed Fwd filter:                         1  (0.000752445); expected 0.0 (1e-05)
Initial search space (Z):               1329  [actual number of targets]
Domain search space  (domZ):               1  [number of targets reported over threshold]
# CPU time: 0.02u 0.00s 00:00:00.02 Elapsed: 00:00:00.01
# Mc/sec: 10594.68
//
Query:       nifE-03292025  [M=556]
Scores for complete sequences (score includes all domains):
   --- full sequence ---   --- best 1 domain ---    -#dom-
    E-value  score  bias    E-value  score  bias    exp  N  Sequence Description
    ------- ------ -----    ------- ------ -----   ---- --  -------- -----------

   [No hits detected that satisfy reporting thresholds]


Domain annotation for each sequence (and alignments):

   [No targets detected that satisfy reporting thresholds]


Internal pipeline statistics summary:
-------------------------------------
Query model(s):                            1  (556 nodes)
Target sequences:                       1329  (399156 residues searched)
Passed MSV filter:                        85  (0.0639579); expected 26.6 (0.02)
Passed bias filter:                       51  (0.0383747); expected 26.6 (0.02)
Passed Vit filter:                         5  (0.00376223); expected 1.3 (0.001)
Passed Fwd filter:                         0  (0); expected 0.0 (1e-05)
Initial search space (Z):               1329  [actual number of targets]
Domain search space  (domZ):               0  [number of targets reported over threshold]
# CPU time: 0.02u 0.00s 00:00:00.02 Elapsed: 00:00:00.01
# Mc/sec: 17593.82
//
Query:       nifN-03292025  [M=700]
Scores for complete sequences (score includes all domains):
   --- full sequence ---   --- best 1 domain ---    -#dom-
    E-value  score  bias    E-value  score  bias    exp  N  Sequence Description
    ------- ------ -----    ------- ------ -----   ---- --  -------- -----------

   [No hits detected that satisfy reporting thresholds]


Domain annotation for each sequence (and alignments):

   [No targets detected that satisfy reporting thresholds]


Internal pipeline statistics summary:
-------------------------------------
Query model(s):                            1  (700 nodes)
Target sequences:                       1329  (399156 residues searched)
Passed MSV filter:                        72  (0.0541761); expected 26.6 (0.02)
Passed bias filter:                       42  (0.0316027); expected 26.6 (0.02)
Passed Vit filter:                         2  (0.00150489); expected 1.3 (0.001)
Passed Fwd filter:                         0  (0); expected 0.0 (1e-05)
Initial search space (Z):               1329  [actual number of targets]
Domain search space  (domZ):               0  [number of targets reported over threshold]
# CPU time: 0.01u 0.00s 00:00:00.01 Elapsed: 00:00:00.01
# Mc/sec: 15507.83
//
Query:       pchlide-04012025  [M=508]
Scores for complete sequences (score includes all domains):
   --- full sequence ---   --- best 1 domain ---    -#dom-
    E-value  score  bias    E-value  score  bias    exp  N  Sequence Description
    ------- ------ -----    ------- ------ -----   ---- --  -------- -----------

   [No hits detected that satisfy reporting thresholds]


Domain annotation for each sequence (and alignments):

   [No targets detected that satisfy reporting thresholds]


Internal pipeline statistics summary:
-------------------------------------
Query model(s):                            1  (508 nodes)
Target sequences:                       1329  (399156 residues searched)
Passed MSV filter:                        54  (0.0406321); expected 26.6 (0.02)
Passed bias filter:                       43  (0.0323552); expected 26.6 (0.02)
Passed Vit filter:                         3  (0.00225734); expected 1.3 (0.001)
Passed Fwd filter:                         0  (0); expected 0.0 (1e-05)
Initial search space (Z):               1329  [actual number of targets]
Domain search space  (domZ):               0  [number of targets reported over threshold]
# CPU time: 0.01u 0.00s 00:00:00.01 Elapsed: 00:00:00.01
# Mc/sec: 18151.19
//
[ok]
# hmmsearch :: search profile(s) against a sequence database
# HMMER 3.4 (Aug 2023); http://hmmer.org/
# Copyright (C) 2023 Howard Hughes Medical Institute.
# Freely distributed under the BSD open source license.
# - - - - - - - - - - - - - - - - - - - - - - - - - - - - - - - - - - - -
# query HMM file:                  ../HMMs/nifV_07242025.hmm
# target sequence database:        ../all_rep_proteins_aa/bacteria/GB_GCA_947628595.1_protein.faa
# - - - - - - - - - - - - - - - - - - - - - - - - - - - - - - - - - - - -

Query:       nifV-07242025  [M=437]
Scores for complete sequences (score includes all domains):
   --- full sequence ---   --- best 1 domain ---    -#dom-
    E-value  score  bias    E-value  score  bias    exp  N  Sequence            Description
    ------- ------ -----    ------- ------ -----   ---- --  --------            -----------
    3.7e-28   95.0   0.0    6.2e-20   67.8   0.0    2.2  2  CANRAN010000010.1_9  # 8112 # 9809 # 1 # ID=10_9;partial=00;s
    4.2e-14   48.6   0.0    1.2e-11   40.5   0.0    2.1  2  CANRAN010000171.1_2  # 501 # 1481 # 1 # ID=171_2;partial=00;s
    6.2e-14   48.1   0.0    1.1e-13   47.3   0.0    1.3  1  CANRAN010000015.1_1  # 1 # 1104 # 1 # ID=15_1;partial=10;star


Domain annotation for each sequence (and alignments):
>> CANRAN010000010.1_9  # 8112 # 9809 # 1 # ID=10_9;partial=00;start_type=ATG;rbs_motif=GGAGG;rbs_spacer=5-10bp;gc_cont=
   #    score  bias  c-Evalue  i-Evalue hmmfrom  hmm to    alifrom  ali to    envfrom  env to     acc
 ---   ------ ----- --------- --------- ------- -------    ------- -------    ------- -------    ----
   1 !   25.0   0.0   1.4e-09   6.2e-07      19      74 ..      33      88 ..      18     152 .. 0.79
   2 !   67.8   0.0   1.4e-22   6.2e-20     178     386 ..     213     441 ..     193     493 .. 0.77

  Alignments for each domain:
  == domain 1  score: 25.0 bits;  conditional E-value: 1.4e-09
        nifV-07242025 19 nDtTLRDGeQaaGvaFsleeklaiAkaLdaaGveelEvGipamGeeereairaiaa 74
                         +   LRDG+Qa    +++e+kl+  +aL ++G +e+E+G p+ +e+e +  r++ +
  CANRAN010000010.1_9 33 CSVDLRDGNQALVTPMNMEQKLEFFHALVDMGFKEIEIGFPSASETEYDICRELIE 88
                         6677*******************************************998888765 PP

  == domain 2  score: 67.8 bits;  conditional E-value: 1.4e-22
        nifV-07242025 178 TlGildPfttlek....vkkLraaldlelEmHaHnDlGlAtANtlaavkaGathvnttvnGLGERAGnAaLeevvlalkrlygidtgidl 263
                          T+ +  P t +++    +++L+++ +  + +H HnD G   A +  a+ aGa+ ++ t+ G GER Gn  +  v l + + +gid ++d+
  CANRAN010000010.1_9 213 TVEMCTPNTYADQieyfIRNLKNREAAIISVHPHNDRGTGVAGAELAMLAGAERIEGTLFGNGERTGNLDIVTVGLNMYT-QGIDPKLDF 301
                          5555666666555111156788888899****************************************777666666665.99******* PP

        nifV-07242025 264 krlpelselvakasgrpvpaqkaivGeavFtHEsGiHvdgllk........dpet......YegldPeevGrerrlvl..GkhsGraavk 337
                          ++lp+  e+ ++ +++++  +++ vG+ vFt  sG H d++ k        +  +      Y ++dP++vGr+++ ++     sG+ + +
  CANRAN010000010.1_9 302 SNLPKYREIYERCTNMKIGERQPYVGDLVFTAFSGSHQDAIKKgfdyvratN--SdkweipYLPIDPADVGRKYEAIVryNSQSGKGGAA 389
                          ****************************************987333322222..1333344778***********999334567888877 PP

        nifV-07242025 338 aala.elgieldeeeaealleavrelaeetkrslteeeLlelveella..ae 386
                           +++ ++g+el ++   +  + v++ + +  ++l+ ++Lle++++     ++
  CANRAN010000010.1_9 390 FIMEtAYGYELPKAMHPEFGALVKAESDHLGKELSPSDLLEVFNKNYIdiEQ 441
                          7775268***********************************9986532212 PP

>> CANRAN010000171.1_2  # 501 # 1481 # 1 # ID=171_2;partial=00;start_type=ATG;rbs_motif=GGAGG;rbs_spacer=5-10bp;gc_cont=
   #    score  bias  c-Evalue  i-Evalue hmmfrom  hmm to    alifrom  ali to    envfrom  env to     acc
 ---   ------ ----- --------- --------- ------- -------    ------- -------    ------- -------    ----
   1 !    6.1   0.0   0.00074      0.33      14      59 ..      12      57 ..       1      62 [. 0.85
   2 !   40.5   0.0   2.7e-14   1.2e-11     131     247 ..     132     251 ..     120     264 .. 0.90

  Alignments for each domain:
  == domain 1  score: 6.1 bits;  conditional E-value: 0.00074
        nifV-07242025 14 kavvinDtTLRDGeQaaGvaFsleeklaiAkaLdaaGveelEvGip 59
                           + + D+TLRDG      aF+ e   ++ ++  + G++ +E G  
  CANRAN010000171.1_2 12 PDIKVFDCTLRDGGLVNNFAFTDEFVRDLYRTNIQSGIDYMEFGYK 57
                         568999****************999999999999999999999865 PP

  == domain 2  score: 40.5 bits;  conditional E-value: 2.7e-14
        nifV-07242025 131 elvklAldaglevsvGaEDaSRadeefllevaevaqeaGasrlRfaDTlGildPfttlekvk...kLraaldlelEmHaHnDlGlAtANt 217
                          e+v++ +++g+e ++ +   S+a+++ l +  e+  +  +  + + D  G l P ++ +  +   ++ ++ + ++ +HaHn   lA ANt
  CANRAN010000171.1_2 132 EMVEYCKNKGYETTINIMAISKANDSDLDDGLEIIGKSCVDTVYIVDSYGSLYPEQMRRLAEkylAMGDKYNKKIGVHAHNNQQLAFANT 221
                          78999*************************************************998665541116788999****************** PP

        nifV-07242025 218 laavkaGathvnttvnGLGERAGnAaLeev 247
                          + a++ G+++++ t+  LG  AGn + e +
  CANRAN010000171.1_2 222 IEALTMGVSYLDSTISSLGRGAGNCPTELL 251
                          *************************99855 PP

>> CANRAN010000015.1_1  # 1 # 1104 # 1 # ID=15_1;partial=10;start_type=Edge;rbs_motif=None;rbs_spacer=None;gc_cont=0.447
   #    score  bias  c-Evalue  i-Evalue hmmfrom  hmm to    alifrom  ali to    envfrom  env to     acc
 ---   ------ ----- --------- --------- ------- -------    ------- -------    ------- -------    ----
   1 !   47.3   0.0   2.4e-16   1.1e-13     159     270 ..      60     170 ..      38     181 .. 0.94

  Alignments for each domain:
  == domain 1  score: 47.3 bits;  conditional E-value: 2.4e-16
        nifV-07242025 159 levaevaqeaGasrlRfaDTlGildPfttlekvkkLraaldlelEmHaHnDlGlAtANtlaavkaGathvnttvnGLGERAGnAaLeevv 248
                          ++ a+  q+aGa  + + D   +l P  t+e v ++++a+d+++ +H+H   GlA+   l +++aGa  ++t +  L +    A+ e +v
  CANRAN010000015.1_1  60 VDYAKRIQDAGADSICIKDMAALLTPYYTAELVGAIKKAVDIPVQLHTHYTSGLASMCLLKGIEAGADRIDTAMSPLANGTSHAPTESMV 149
                          6778999*********************************************************************************** PP

        nifV-07242025 249 lalkrlygidtgidlkrlpels 270
                          +al+  +++dtg+dl  l+e+ 
  CANRAN010000015.1_1 150 AALQG-TEYDTGLDLVLLSEIR 170
                          ***99.899*****99988875 PP



Internal pipeline statistics summary:
-------------------------------------
Query model(s):                            1  (437 nodes)
Target sequences:                       1329  (399156 residues searched)
Passed MSV filter:                        35  (0.0263356); expected 26.6 (0.02)
Passed bias filter:                       24  (0.0180587); expected 26.6 (0.02)
Passed Vit filter:                         5  (0.00376223); expected 1.3 (0.001)
Passed Fwd filter:                         3  (0.00225734); expected 0.0 (1e-05)
Initial search space (Z):               1329  [actual number of targets]
Domain search space  (domZ):               3  [number of targets reported over threshold]
# CPU time: 0.01u 0.00s 00:00:00.01 Elapsed: 00:00:00.01
# Mc/sec: 10436.91
//
[ok]
