# hmmsearch :: search profile(s) against a sequence database
# HMMER 3.4 (Aug 2023); http://hmmer.org/
# Copyright (C) 2023 Howard Hughes Medical Institute.
# Freely distributed under the BSD open source license.
# - - - - - - - - - - - - - - - - - - - - - - - - - - - - - - - - - - - -
# query HMM file:                  ../HMMs/combined_nif_04012025.hmm
# target sequence database:        ../all_rep_proteins_aa/bacteria/GB_GCA_937902455.1_protein.faa
# - - - - - - - - - - - - - - - - - - - - - - - - - - - - - - - - - - - -

Query:       nifH-03292025  [M=327]
Scores for complete sequences (score includes all domains):
   --- full sequence ---   --- best 1 domain ---    -#dom-
    E-value  score  bias    E-value  score  bias    exp  N  Sequence            Description
    ------- ------ -----    ------- ------ -----   ---- --  --------            -----------
    3.1e-07   26.6   0.2    5.6e-06   22.4   0.3    2.2  2  CALELI010000054.1_4  # 7881 # 8957 # -1 # ID=54_4;partial=00;


Domain annotation for each sequence (and alignments):
>> CALELI010000054.1_4  # 7881 # 8957 # -1 # ID=54_4;partial=00;start_type=ATG;rbs_motif=AAA;rbs_spacer=13bp;gc_cont=0.5
   #    score  bias  c-Evalue  i-Evalue hmmfrom  hmm to    alifrom  ali to    envfrom  env to     acc
 ---   ------ ----- --------- --------- ------- -------    ------- -------    ------- -------    ----
   1 !   22.4   0.3   3.1e-09   5.6e-06      16      40 ..     112     136 ..      98     142 .. 0.89
   2 !    1.5   0.0    0.0072        13     197     229 ..     297     329 ..     242     354 .. 0.63

  Alignments for each domain:
  == domain 1  score: 22.4 bits;  conditional E-value: 3.1e-09
        nifH-03292025  16 GKGGiGKSttasnlsaalaeegkkv 40 
                          GKGG+GKSt+a nl+  la++g kv
  CALELI010000054.1_4 112 GKGGVGKSTVAVNLAIGLAKMGMKV 136
                          ***********************98 PP

  == domain 2  score: 1.5 bits;  conditional E-value: 0.0072
        nifH-03292025 197 eeelveefaeklgtqiiafvprsnevqkaelek 229
                           +e v+++ae+l++ ++a++p  + +q++  ++
  CALELI010000054.1_4 297 GKEGVKNLAEELNVPLLAQIPLVQGIQESGDKG 329
                          367799999999999999999999999886544 PP



Internal pipeline statistics summary:
-------------------------------------
Query model(s):                            1  (327 nodes)
Target sequences:                       1791  (671538 residues searched)
Passed MSV filter:                        73  (0.0407594); expected 35.8 (0.02)
Passed bias filter:                       56  (0.0312674); expected 35.8 (0.02)
Passed Vit filter:                        10  (0.00558347); expected 1.8 (0.001)
Passed Fwd filter:                         1  (0.000558347); expected 0.0 (1e-05)
Initial search space (Z):               1791  [actual number of targets]
Domain search space  (domZ):               1  [number of targets reported over threshold]
# CPU time: 0.02u 0.00s 00:00:00.02 Elapsed: 00:00:00.01
# Mc/sec: 15676.03
//
Query:       nifD-03292025  [M=482]
Scores for complete sequences (score includes all domains):
   --- full sequence ---   --- best 1 domain ---    -#dom-
    E-value  score  bias    E-value  score  bias    exp  N  Sequence Description
    ------- ------ -----    ------- ------ -----   ---- --  -------- -----------

   [No hits detected that satisfy reporting thresholds]


Domain annotation for each sequence (and alignments):

   [No targets detected that satisfy reporting thresholds]


Internal pipeline statistics summary:
-------------------------------------
Query model(s):                            1  (482 nodes)
Target sequences:                       1791  (671538 residues searched)
Passed MSV filter:                        76  (0.0424344); expected 35.8 (0.02)
Passed bias filter:                       43  (0.0240089); expected 35.8 (0.02)
Passed Vit filter:                         4  (0.00223339); expected 1.8 (0.001)
Passed Fwd filter:                         0  (0); expected 0.0 (1e-05)
Initial search space (Z):               1791  [actual number of targets]
Domain search space  (domZ):               0  [number of targets reported over threshold]
# CPU time: 0.02u 0.00s 00:00:00.02 Elapsed: 00:00:00.01
# Mc/sec: 17085.88
//
Query:       nifK-03292025  [M=490]
Scores for complete sequences (score includes all domains):
   --- full sequence ---   --- best 1 domain ---    -#dom-
    E-value  score  bias    E-value  score  bias    exp  N  Sequence Description
    ------- ------ -----    ------- ------ -----   ---- --  -------- -----------

   [No hits detected that satisfy reporting thresholds]


Domain annotation for each sequence (and alignments):

   [No targets detected that satisfy reporting thresholds]


Internal pipeline statistics summary:
-------------------------------------
Query model(s):                            1  (490 nodes)
Target sequences:                       1791  (671538 residues searched)
Passed MSV filter:                        78  (0.0435511); expected 35.8 (0.02)
Passed bias filter:                       56  (0.0312674); expected 35.8 (0.02)
Passed Vit filter:                         5  (0.00279174); expected 1.8 (0.001)
Passed Fwd filter:                         0  (0); expected 0.0 (1e-05)
Initial search space (Z):               1791  [actual number of targets]
Domain search space  (domZ):               0  [number of targets reported over threshold]
# CPU time: 0.03u 0.00s 00:00:00.03 Elapsed: 00:00:00.01
# Mc/sec: 22827.43
//
Query:       nifB-03292025  [M=505]
Scores for complete sequences (score includes all domains):
   --- full sequence ---   --- best 1 domain ---    -#dom-
    E-value  score  bias    E-value  score  bias    exp  N  Sequence Description
    ------- ------ -----    ------- ------ -----   ---- --  -------- -----------

   [No hits detected that satisfy reporting thresholds]


Domain annotation for each sequence (and alignments):

   [No targets detected that satisfy reporting thresholds]


Internal pipeline statistics summary:
-------------------------------------
Query model(s):                            1  (505 nodes)
Target sequences:                       1791  (671538 residues searched)
Passed MSV filter:                        67  (0.0374093); expected 35.8 (0.02)
Passed bias filter:                       44  (0.0245673); expected 35.8 (0.02)
Passed Vit filter:                         3  (0.00167504); expected 1.8 (0.001)
Passed Fwd filter:                         0  (0); expected 0.0 (1e-05)
Initial search space (Z):               1791  [actual number of targets]
Domain search space  (domZ):               0  [number of targets reported over threshold]
# CPU time: 0.02u 0.00s 00:00:00.02 Elapsed: 00:00:00.01
# Mc/sec: 26185.64
//
Query:       nifE-03292025  [M=556]
Scores for complete sequences (score includes all domains):
   --- full sequence ---   --- best 1 domain ---    -#dom-
    E-value  score  bias    E-value  score  bias    exp  N  Sequence Description
    ------- ------ -----    ------- ------ -----   ---- --  -------- -----------

   [No hits detected that satisfy reporting thresholds]


Domain annotation for each sequence (and alignments):

   [No targets detected that satisfy reporting thresholds]


Internal pipeline statistics summary:
-------------------------------------
Query model(s):                            1  (556 nodes)
Target sequences:                       1791  (671538 residues searched)
Passed MSV filter:                        87  (0.0485762); expected 35.8 (0.02)
Passed bias filter:                       56  (0.0312674); expected 35.8 (0.02)
Passed Vit filter:                         6  (0.00335008); expected 1.8 (0.001)
Passed Fwd filter:                         0  (0); expected 0.0 (1e-05)
Initial search space (Z):               1791  [actual number of targets]
Domain search space  (domZ):               0  [number of targets reported over threshold]
# CPU time: 0.02u 0.00s 00:00:00.02 Elapsed: 00:00:00.02
# Mc/sec: 17653.69
//
Query:       nifN-03292025  [M=700]
Scores for complete sequences (score includes all domains):
   --- full sequence ---   --- best 1 domain ---    -#dom-
    E-value  score  bias    E-value  score  bias    exp  N  Sequence Description
    ------- ------ -----    ------- ------ -----   ---- --  -------- -----------

   [No hits detected that satisfy reporting thresholds]


Domain annotation for each sequence (and alignments):

   [No targets detected that satisfy reporting thresholds]


Internal pipeline statistics summary:
-------------------------------------
Query model(s):                            1  (700 nodes)
Target sequences:                       1791  (671538 residues searched)
Passed MSV filter:                        68  (0.0379676); expected 35.8 (0.02)
Passed bias filter:                       48  (0.0268007); expected 35.8 (0.02)
Passed Vit filter:                         4  (0.00223339); expected 1.8 (0.001)
Passed Fwd filter:                         0  (0); expected 0.0 (1e-05)
Initial search space (Z):               1791  [actual number of targets]
Domain search space  (domZ):               0  [number of targets reported over threshold]
# CPU time: 0.02u 0.00s 00:00:00.02 Elapsed: 00:00:00.02
# Mc/sec: 18034.85
//
Query:       pchlide-04012025  [M=508]
Scores for complete sequences (score includes all domains):
   --- full sequence ---   --- best 1 domain ---    -#dom-
    E-value  score  bias    E-value  score  bias    exp  N  Sequence Description
    ------- ------ -----    ------- ------ -----   ---- --  -------- -----------

   [No hits detected that satisfy reporting thresholds]


Domain annotation for each sequence (and alignments):

   [No targets detected that satisfy reporting thresholds]


Internal pipeline statistics summary:
-------------------------------------
Query model(s):                            1  (508 nodes)
Target sequences:                       1791  (671538 residues searched)
Passed MSV filter:                        61  (0.0340592); expected 35.8 (0.02)
Passed bias filter:                       45  (0.0251256); expected 35.8 (0.02)
Passed Vit filter:                         3  (0.00167504); expected 1.8 (0.001)
Passed Fwd filter:                         0  (0); expected 0.0 (1e-05)
Initial search space (Z):               1791  [actual number of targets]
Domain search space  (domZ):               0  [number of targets reported over threshold]
# CPU time: 0.02u 0.00s 00:00:00.02 Elapsed: 00:00:00.01
# Mc/sec: 28373.78
//
[ok]
# hmmsearch :: search profile(s) against a sequence database
# HMMER 3.4 (Aug 2023); http://hmmer.org/
# Copyright (C) 2023 Howard Hughes Medical Institute.
# Freely distributed under the BSD open source license.
# - - - - - - - - - - - - - - - - - - - - - - - - - - - - - - - - - - - -
# query HMM file:                  ../HMMs/nifV_07242025.hmm
# target sequence database:        ../all_rep_proteins_aa/bacteria/GB_GCA_937902455.1_protein.faa
# - - - - - - - - - - - - - - - - - - - - - - - - - - - - - - - - - - - -

Query:       nifV-07242025  [M=437]
Scores for complete sequences (score includes all domains):
   --- full sequence ---   --- best 1 domain ---    -#dom-
    E-value  score  bias    E-value  score  bias    exp  N  Sequence             Description
    ------- ------ -----    ------- ------ -----   ---- --  --------             -----------
    4.2e-79  263.2   0.2    5.7e-79  262.8   0.2    1.1  1  CALELI010000148.1_1   # 186 # 1754 # -1 # ID=148_1;partial=00
    3.1e-17   59.4   0.2    1.7e-15   53.7   0.1    2.1  2  CALELI010000014.1_2   # 2532 # 3947 # -1 # ID=14_2;partial=00
    0.00024   16.9   0.0    0.00038   16.3   0.0    1.2  1  CALELI010000200.1_10  # 7798 # 9576 # 1 # ID=200_10;partial=0


Domain annotation for each sequence (and alignments):
>> CALELI010000148.1_1  # 186 # 1754 # -1 # ID=148_1;partial=00;start_type=GTG;rbs_motif=AAAA;rbs_spacer=9bp;gc_cont=0.5
   #    score  bias  c-Evalue  i-Evalue hmmfrom  hmm to    alifrom  ali to    envfrom  env to     acc
 ---   ------ ----- --------- --------- ------- -------    ------- -------    ------- -------    ----
   1 !  262.8   0.2   9.6e-82   5.7e-79       9     385 ..      14     399 ..       5     449 .. 0.86

  Alignments for each domain:
  == domain 1  score: 262.8 bits;  conditional E-value: 9.6e-82
        nifV-07242025   9 kmkkakavvinDtTLRDGeQaaGvaFsleeklaiAka.LdaaGveelEvGipamGeeereairaiaalglkakllaWcRl...r..esdi 92 
                           mk  ++v i DtTLRDGeQ+ Gv+F  +eklaiA++ L+++ v+ +Ev  + +++ e+e+ r+i++ + k  ++    +   +  +  +
  CALELI010000148.1_1  14 GMK--QHVEIMDTTLRDGEQTCGVSFLPHEKLAIARMlLEELKVDRVEVASARVSDGEKESTRTICKWAEKVGMIDRIEVlgfVdgKISV 101
                          344..58****************************983589************************9976665544322221112113457 PP

        nifV-07242025  93 eaaaalgvkrvdlsipvSdiqiaaklkrdrawvleeleelvklAldaglevsvGaEDaSRa...deefllevaevaqea..GasrlRfaD 177
                          +  +++g k+++l    S ++ +++lk++ +  +++++++v++A+ +g++v v +ED S     d e ++++++  + +    sr+ + D
  CALELI010000148.1_1 102 DWITSCGGKVMNLLTKGSRKHCEEQLKKTPEEHIADIKNTVEYAQGQGVRVNVYLEDWSNGmkhDAEYVYNLVSNLTGIltEESRIMLPD 191
                          78899************************99**************************99762226666666666555431145799999* PP

        nifV-07242025 178 TlGildPfttlekvkkLraal.dlelEmHaHnDlGlAtANtlaavkaGathvnttvnGLGERAGnAaLeevvlalkrlygidtgidlkrl 266
                          TlGil+P++++e v  +++++ d ++++HaHnD+ +A +N +aav aG++ + tt+nGLGERAGnA+L  v + l+   +++t+i+ +rl
  CALELI010000148.1_1 192 TLGILNPMKVTEYVGLMVERFpDTKFDFHAHNDYDMAISNVFAAVMAGVNGLHTTINGLGERAGNASLASVQAILNDQLTVKTNINEERL 281
                          ****************999974699***************************************************************** PP

        nifV-07242025 267 pelselvakasgrpvpaqkaivGeavFtHEsGiHvdgllkdpetYegldPeevGrerrlvlGkhsGraavkaalaelgieldeeeaeall 356
                          ++ s++v++ sg +++ +++ivGe+vFt  +G+H+dg  k++   ++l Pe++Gr+r+  lGk sG+a +++ l+elg++lde+ ++++ 
  CALELI010000148.1_1 282 MAASRMVESFSGIAIASNQPIVGENVFTQVAGVHADGDKKNNLYCNKLLPERFGRKREYALGKNSGKANIQKNLEELGLDLDEDAMRKVT 371
                          **************************************999999999******************************************* PP

        nifV-07242025 357 eavrelaeetkrslteeeLlelveellaa 385
                          +++ el  ++k ++t+e+L  +++++l++
  CALELI010000148.1_1 372 ARIIELG-DKKETVTQEDLPFIISDVLKH 399
                          ***9875.67899999***9999886643 PP

>> CALELI010000014.1_2  # 2532 # 3947 # -1 # ID=14_2;partial=00;start_type=ATG;rbs_motif=AAA;rbs_spacer=14bp;gc_cont=0.5
   #    score  bias  c-Evalue  i-Evalue hmmfrom  hmm to    alifrom  ali to    envfrom  env to     acc
 ---   ------ ----- --------- --------- ------- -------    ------- -------    ------- -------    ----
   1 !   53.7   0.1   2.8e-18   1.7e-15      15     231 ..       4     227 ..       1     231 [. 0.86
   2 !    3.8   0.0    0.0039       2.4     325     385 ..     292     352 ..     276     403 .. 0.70

  Alignments for each domain:
  == domain 1  score: 53.7 bits;  conditional E-value: 2.8e-18
        nifV-07242025  15 avvinDtTLRDGeQaaGvaFsleeklaiAkaLdaaGveelEvGipamGeeereairaiaalglkakllaWcRlresd.i....eaaaalg 99 
                          ++ + D T++  +   G  +s ++kl+ +k Ld++Gv  +E    + G++++  ++++a++  +++l     + ++d i    +a ++  
  CALELI010000014.1_2   4 RIFVSDITMKLADGVFGNVLSFRQKLEFSKLLDKLGVCVIETCGLSNGKKDVLLVKSLASAIRNSTLAIPVDIFSTDsIsetwNALMDAR 93 
                          57888999888888889999999******************999999*****99998888544455544444433332311115566777 PP

        nifV-07242025 100 vkrvdlsipvSdiqiaaklkrdrawvleeleelvklAldaglevsvGaEDaSRadeefllevaevaqeaGasrlRfaDTlGildPfttle 189
                            r+++s+pvS +q+++  + + a vle + + vk+ ++   +v   a D  Rad++fl +++++a + Ga+ + + D  G l  f+ +e
  CALELI010000014.1_2  94 HPRLQVSVPVSTVQMEYLCHLKPAAVLELVGSKVKECKSLCDDVEFIAVDFTRADTDFLFSIIDTAIQNGATVITMHDSAGTLFGFEFHE 183
                          789*****************9999****************************************************************** PP

        nifV-07242025 190 kvkkLraald..lelEmHaHnDlGlAtANtlaavkaGathvntt 231
                           ++++r +++  + l + + n l lA + ++aav aGa  + t 
  CALELI010000014.1_2 184 VIEAIRVHVPenVRLGVNCSNELFLADSCAVAAVCAGADEIKTV 227
                          *******997225567899*********************9986 PP

  == domain 2  score: 3.8 bits;  conditional E-value: 0.0039
        nifV-07242025 325 lvlGkhsGraavkaalaelgieldeeeaealleavrelaeetkrslteeeLlelveell.aa 385
                          l l +h  +++v a+ ++lg+ lde++ +++ +a  +la+e+  +++++eL +++++++ +a
  CALELI010000014.1_2 292 LQLTRHDNKETVVAIANKLGYYLDEDDSDKVYDAFLRLASEN-GKVEAKELDAIIASVAfQA 352
                          67889***************************9977776654.4567889999998866422 PP

>> CALELI010000200.1_10  # 7798 # 9576 # 1 # ID=200_10;partial=00;start_type=ATG;rbs_motif=AATAA;rbs_spacer=9bp;gc_cont=
   #    score  bias  c-Evalue  i-Evalue hmmfrom  hmm to    alifrom  ali to    envfrom  env to     acc
 ---   ------ ----- --------- --------- ------- -------    ------- -------    ------- -------    ----
   1 !   16.3   0.0   6.3e-07   0.00038     156     233 ..     156     234 ..     124     237 .. 0.88

  Alignments for each domain:
  == domain 1  score: 16.3 bits;  conditional E-value: 6.3e-07
         nifV-07242025 156 efllevaevaqeaGasrlRfaDTlGildPfttlekvkkLraal.dlelEmHaHnDlGlAtANtlaavkaGathvnttvn 233
                           e  +++ae+  +aGa  + + D  Gi +P    + v  ++++  ++ +  H H   Gl+ A  l  ++aGa  ++t ++
  CALELI010000200.1_10 156 EYYADIAEQLIAAGAPEICLKDMAGIGQPAMLGKLVGMIKEKHpEIIIQYHGHSGPGLSMASILEVCRAGADVIDTAIE 234
                           566899*********************************976527999****************************986 PP



Internal pipeline statistics summary:
-------------------------------------
Query model(s):                            1  (437 nodes)
Target sequences:                       1791  (671538 residues searched)
Passed MSV filter:                        49  (0.027359); expected 35.8 (0.02)
Passed bias filter:                       40  (0.0223339); expected 35.8 (0.02)
Passed Vit filter:                         5  (0.00279174); expected 1.8 (0.001)
Passed Fwd filter:                         3  (0.00167504); expected 0.0 (1e-05)
Initial search space (Z):               1791  [actual number of targets]
Domain search space  (domZ):               3  [number of targets reported over threshold]
# CPU time: 0.02u 0.00s 00:00:00.02 Elapsed: 00:00:00.02
# Mc/sec: 14466.14
//
[ok]
